video_id,published_at,title,channel_title,category_id,category_name,tags,duration,definition,caption_available,licensed_content,views,likes,comments
tHVDy4vYApA,2025-11-28T13:09:15Z,BAROTA (MUSIC VIDEO) SIDHU MOOSE WALA | THE KIDD | LATEST PUNJABI SONGS 2025,Sidhu Moose Wala,10,Music,"sidhu moosewala, sidhu moosewala latest song, sidhu moosewala leaked songs, sidhu moosewala official videos, sidhu moosewala official song, latest punjabi song 2020",319,hd,false,True,37920249,2310860,4010233
Fv0leN8TmR8,2025-12-07T00:00:04Z,The Boys - Final Season Teaser Trailer | Prime Video,Prime Video,24,Entertainment,"the boys, the boys season 5, the boys s5, the boys season 5 trailer, the boys season 5 teaser, the boys s5 trailer, the boys s5 teaser, the boys soldier boy, the boys homelander, the boys butcher, homelander, butcher, soldier boy, starlight, hughie, homelander vs butcher, butcher vs homelander, homelander vs soldier boy, the boys final season, the boys final season trailer, antony starr, karl urban, jensen ackles, erin moriarty, jack quaid, karen fukuhara, chace crawford",121,hd,true,True,5107672,254047,13797
S-LMSpzlnc0,2025-12-07T15:44:41Z,Race Highlights | 2025 Abu Dhabi Grand Prix,FORMULA 1,17,Sports,"F1, Formula One, Formula 1, Sports, Sport, Action, GP, Grand Prix, Auto Racing, Motor Racing, abu dhabi, f1 2025 championship",503,hd,false,True,2548229,66108,6205
FeaRXx2VDhI,2025-12-05T11:30:23Z,Top 50 Christmas Songs of All Time 🎄 Best Christmas Music Playlist,Christmas Songs and Carols - Love to Sing,10,Music,"top christmas song, christmas songs, top christmas songs of all time, top 100 christmas songs of all time, best christmas songs of all time, best christmas songs, top christmas songs, top 100 christmas songs, classic christmas songs, christmas songs playlist, best christmas music, christmas songs medley, top 100 christmas songs and carols, top 100 christmas songs and carols playlist",8351,hd,false,True,1378294,4461,239
VI6XO8EijT4,2025-12-05T20:00:28Z,DIGITAL CIRCUS EP 7 TRAILER!!,GLITCH,1,Film & Animation,"glitch, glitch productions, digital circus, the amazing digital circus, murder drones, Pomni, Uzi, Jax, Ragatha, Kinger, Gangle, Zooble, Caine, Bubble, 3D, Animation, 3D Animation, Indie Animation, Gummigoo",58,hd,true,True,6101816,523768,29607
sRGe86bUsOs,2025-12-06T20:59:57Z,Christmas Brainrots Update + SANTA FUSE Machine!,CaylusBlox,20,Gaming,"caylusblox, caylus roblox, caylus, roblox, Steal a brainrot update, ADMIN ABUSE In Steal a Brainrot!, Steal a Brainrot UPDATE + Admin Abuse, admin abuse, steal a brainrot, witchs fuse, caylus steal a brainrot, dump update, caylus aura, caylus admin abuse, steal a brainrot update, w brainrot, Taco Tuesday ADMIN ABUSE + New BRAINROT!, tung tung tung sahur, tung tung sahur steal a brainrot, santa fuse machine, caylus fuse machine, caylus steak, caylus steal a brainrot christmas",12210,hd,false,True,3312561,93905,975
9ME5J_bnFiA,2025-12-03T17:00:10Z,Nikita & Mariglen Hazizaj - Engjëll babi im (Official Video),Mariglen Hazizaj,24,Entertainment,nikita mariglen hazizaj engjell babi official video,324,hd,false,True,803802,41224,3478
LvUnF8oApaM,2025-11-13T12:30:07Z,Kalamkaval Official Trailer | Mammootty | Vinayakan | Jithin K Jose | MammoottyKampany,Mammootty Kampany,24,Entertainment,"kalamkaval mammootty, mammootty kalamkaval, mammootty kalamkaval movie, kalamkaval mammootty teaser, kalamkaval mammootty latest, kalamkaval mammootty vinayakan, kalamkaval mammootty movie teaser, kalamkaval mammootty movie trailer, kalamkaval mammootty movie release date, kalamkaval mammootty movie latest update, kalamkaval movie, kalamkaval malayalam movie, kalamkaval, kalamkaval motion poster, kalamkaval movie news, kalamkaval bts, kalamkaval promo teaser, mammooty",110,hd,true,True,2716834,82900,4122
Ntp522Cad-s,2025-12-07T22:10:52Z,REAL MADRID 0 - 2 CELTA | RESUMEN LALIGA EA SPORTS,LALIGA EA SPORTS,17,Sports,"RC Celta, Real Madrid, Real Madrid vs. RC Celta, Madrid, Celta, Real Madrid Celta, Real Madrid vs Celta, LaLiga, jornada 15 laliga ea sports, laliga ea sports, highlights Real Madrid Celta, resumen Real Madrid Celta, goles Celta, Williot, Valverde, Mbappé, Santiago Bernabéu, mejores momentos fútbol, partido LaLiga, liga española, highlights fútbol, resumen fútbol, Celta vigo, Celta de Vigo",195,hd,false,True,1041920,25592,2755
NED7nev2ywQ,2025-11-21T04:59:56Z,"Stray Kids ""Do It"" M/V",JYP Entertainment,10,Music,"JYP Entertainment, JYP, Stray Kids, 스트레이 키즈, SKZ, 스키즈, 방찬, BANG CHAN, 리노, LEE KNOW, 창빈, CHANGBIN, 현진, 황현진, HYUNJIN, 한, 한지성, HAN, 필릭스, FELIX, 용복, 승민, 김승민, SEUNGMIN, 아이엔, I.N, stray kids comeback, 스트레이 키즈 컴백, 스키즈 컴백, skz comeback, skz, 스키즈 티저, SKZ DO IT, stray kids do it, skz it tape, skz mv, skz music video, 스키즈 뮤비, 스키즈 두잇 뮤비, 두잇 뮤비, do it mv, 스키즈 두잇, 두잇 뮤직비디오, 스트레이 키즈 뮤비, stray kids music video, skz do it, 스트레이 키즈 뮤직비디오, 두잇 티저, 스키즈 두잇 티저, do it teaser, skz do it teaser, do it mv teaser",181,hd,true,True,40379630,1488356,144274
XRRnP91SSrQ,2025-12-05T16:00:21Z,Welcome Home | Poppy Playtime Chapter 5 Cinematic Trailer,Mob Entertainment,20,Gaming,,58,hd,true,True,2698345,197373,14421
-QWbwlumGAw,2025-11-26T20:45:01Z,SIDEMEN AMONG US BUT HALF THE LOBBY ARE JESTERS,MoreSidemen,22,People & Blogs,"sidemen, moresidemen, miniminter, ksi, zerkaa, behzinga, tbjzl, vikkstar, wroetoshaw",4820,hd,false,True,4584050,125743,4557
KgpnfT5bgLY,2025-11-08T12:33:03Z,Jana Nayagan – Thalapathy Kacheri Lyric Video| Thalapathy Vijay| H Vinoth| Anirudh| Pooja Hegde| KVN,T-Series,10,Music,"tseries, tseries songs, tamil songs, new tamil song, thalapathy kacheri song, thalapathy kacheri full song, thalapathy kacheri lyric video, jana nayagan song, thalapathy kacheri jana nayagan, thalapathy kacheri pooja hegde, anirudh new song, thalapathy kacheri first single, jana nayagan movie song, thalapathy vijay jana nayagan, thalapathy vijay new song, jana nayagan song tamil, thalapathy vijay jana nayagan song, thalapathy kacheri, Thalapathi kacheri, Thalapati kacheri",202,hd,false,True,59675630,1409385,92546
DL133d4bdGM,2025-11-14T15:16:41Z,Vilaayath Budha Official Trailer | Prithviraj Sukumaran |Jayan Nambiar |Urvassi Theatres|Jakes Bejoy,Magic Frames Music,10,Music,"Vilaayath Budha teaser, Vilaayath Budha Prithviraj teaser, Vilaayath Budha official teaser, Vilaayath Budha Malayalam movie teaser, Prithviraj new movie 2025, Prithviraj Sukumaran Vilaayath Budha, Vilaayath Budha Malayalam teaser, Malayalam teaser 2025, Prithviraj Sukumaran latest movie, Vilaayath Budha Jayan Nambiar, Malayalam thriller teaser, Mollywood teaser 2025, Vilaayath Budha promo, Vilaayath Budha official Malayalam teaser",149,hd,true,True,2290162,35783,2316
FLkL2g4FLso,2025-12-07T09:40:29Z,🔴LIVE | FREE SECRETS in Roblox Steal a Brainrot 🔴,Swazr Rblx,20,Gaming,,13,hd,false,True,492858,9671,5
BKOVzHcjEIo,2025-11-18T06:50:49Z,Dhurandhar Official Trailer | Ranveer Singh | Aditya Dhar | In Cinemas 5th December 2025,JioStudios,24,Entertainment,"Jio Studios, Dhurandhar First Look, dhurandhar ranveer singh, dhurandhar aditya dhar, dhurandhar movie, dhurandhar teaser, Ranveer singh, aditya dhar, dhurandhar 2025 movies, arjun rampal, dhurandhar song, dhurandhar, dhurandhar hanumankind, dhurandhar r madhavan, dhurandhar sanjay dutt, dhurandhar akshaye khanna, hanumankind ranveer singh, dhurandhar sara arjun, dhurandhar official trailer, dhurandhar trailer, dhurandhar trailer launch, dhurandhar jasmine sandlas",248,hd,true,True,47341855,573632,37727
KgsTBDRttPg,2025-12-06T14:00:39Z,I Got Hunted By the Minecraft LAW,Wemmbu,20,Gaming,"wemmbu, flamefrags, unstable smp, wemmbu vs flamefrags, wemmbu unstable smp, wemmbu farlands, minecraft farlands, wemmbu minecraft, wemmbu orbital cannon, orbital strike cannon, unstable universe, wemmbu unstable universe, weembu, wembu, wemmbu dead, How I DIED on a Hardcore Minecraft SMP, wemmbu flamefrags, 2 Minecraft Pros VS 1000 Players, parrotx2, spokeishere, wemmbu prisoner, wemmbu prison, lettucek, wemmbu lettucek, wemmbu law, wemmbu escape",4688,hd,false,True,3568793,187703,18995
zHhR3daI3bY,2025-11-10T12:00:01Z,Man Vs Baby | Official Trailer | Netflix,Netflix,24,Entertainment,"Ashley Jensen, Baby, Baby’s Day Out, Bean, Christmas, Home Alone, London, Man Vs Baby, Man Vs Bee, Mr Bean, Rowan, Rowan Atkinson, Trevor, baby Jesus, nativity",124,hd,true,True,9388902,247681,8917
L6xI-QUR7Do,2025-12-03T19:33:17Z,STEAL A BRAINROT GIVEAWAY LIVE | STEAL A BRAINROT FREE SECRETS + FREE BRAINROT GODS,Joxy,20,Gaming,"steal a brainrot giveaway, steal a brainrot giveaway live, steal a brainrot secret giveaway, steal a brainrot live giveaway, steal a brainrot brainrot god giveaway, steal a brainrot stream, steal a brainrot live, steal a brainrot 24/7 stream, steal a brainrot, steal a brainrot god, w steal a brainrot, steal a brainrot game, steal a brainrot gifting, steal a brainrot mod, steal a brainrot glitch, steal a brainrot 24/7, roblox steal a brainrot, steal a brainrot roblox",27,hd,false,True,485832,21886,75
qlCBzdZSnlY,2025-11-21T14:26:28Z,Akhanda 2 Thaandavam Trailer (Telugu) | Nandamuri Balakrishna | Boyapati Sreenu | Thaman S | DEC 5th,14 Reels Plus,1,Film & Animation,"Akhanda 2 Telugu Trailer, Akhanda, Akhanda 2 Trailer, Balakrishna New Movie Trailer, NBK Trailer, NBK New Movie Trailer, Akanda Telugu Trailer",162,hd,false,True,17815513,433546,9726
Oa0tqKHb4VA,2025-12-07T14:00:51Z,Unstable SMP: The First King,Parrot,20,Gaming,"Minecraft, Minecraft SMP, SMP, Minecraft Server, LifeSteal SMP, School Minecraft Server, School SMP, School Parrot, Parrot, ParrotX2, Dream SMP, TommyInnit, LifeSteal, parrot lifesteal smp, Spoke, minecraft survival, minecraft hardcore, minecraft challenge, minecraft server, HermitCraft, MumboJumbo, Grian, why i broke 100+ bedrock, Here's Why I Made 12240 Minecraft Cakes, Minecraft Hunt, LifeSteal Season 3, 1 Heart Minecraft, LifeSteal Season 4, Why I Removed the World",3568,hd,false,True,1576526,89629,10494
uMCr6onxexI,2025-12-07T15:33:00Z,[NEP] 2025 PMGC League |  Last Chance Last Day,Ansh YT,20,Gaming,,16834,hd,false,True,94759,2307,
uafiB6jBO2I,2025-11-25T01:48:24Z,SML Movie: Junior Plays Grand Theft Auto 6,SML,24,Entertainment,"supermariologan, sml, movie, jeffy, jeffry, jeff, funny, jokes, comedy, skit, entertainment, joke, show, laugh, superluigilogan, sll, superbowserlogan, sbl, puppet, puppets, video game, grand theft auto 6, gta 6, footage, gameplay, graphics, junior, joseph, cody, friends, fun, hilarious, brooklyn guy, parody, sml movie, junior plays",662,hd,false,True,2229863,61747,7096
_3IkaGoyGKQ,2025-11-12T21:04:26Z,THE BIG FINALE (Dispatch 7 & 8),jacksepticeye,20,Gaming,jacksepticeye,9937,hd,false,True,3391661,170121,13543
