video_id,published_at,title,channel_title,category_id,category_name,tags,duration,definition,caption_available,licensed_content,views,likes,comments
udFsogly8Us,2025-12-04T22:50:53Z,JLEXIS X MICHAEL FLORES X SHADOW BLOW X ALOFOKE MUSIC - ME TOCO VERTE BRILLAR,AlofokeMusicSounds,10,Music,"Bad Bunny, Dembow, Reggaeton, Karol G, Anuel AA, Trap, Rap, Salsa, Merengue, Feid, Santiago Matias, W Sound, Rochy RD, Yailin La Mas Viral, El Alfa, Bulin 47, Romeo Santos, Anthony Santos",184,hd,false,True,2874946,263039,22108
VI6XO8EijT4,2025-12-05T20:00:28Z,DIGITAL CIRCUS EP 7 TRAILER!!,GLITCH,1,Film & Animation,"glitch, glitch productions, digital circus, the amazing digital circus, murder drones, Pomni, Uzi, Jax, Ragatha, Kinger, Gangle, Zooble, Caine, Bubble, 3D, Animation, 3D Animation, Indie Animation, Gummigoo",58,hd,true,True,4246050,432132,25504
esPT8WCk_AQ,2025-12-05T17:16:52Z,Me Volví LOCO por un Charizard de 2.900€,Rubius Z,24,Entertainment,"elrubius, rubius, nuevo, 2025, card, tcg, pokemon, charizard, inferno x, hit, full art, ex, new, opening, cartas, phantasmal flames, mega charizard x, mega, carta, cara, caro, meowth, 2026, dinero, cajas, caja, unboxing, sorpresa, mistery, box, meme, memes, gracioso, divertido",1343,hd,false,True,972697,79499,1590
-76svVX5Cd8,2025-12-04T22:59:00Z,"Natos y Waor, Recycled J - MOLTISANTI (Videoclip oficial) [Hijos de la Ruina Vol. 4]",Natos y Waor,10,Music,,233,hd,false,True,125861,8557,469
XRRnP91SSrQ,2025-12-05T16:00:21Z,Welcome Home | Poppy Playtime Chapter 5 Cinematic Trailer,Mob Entertainment,20,Gaming,,58,hd,true,True,1787749,161221,11923
n09iOx6NwP0,2025-12-06T01:05:28Z,DEBATE DEL MUNDIAL CON LA COBRA Y LATINOS ! DjMaRiiO,DjMaRiiO,20,Gaming,"djmariio, djmario, djmarrio, djmarioo, dj, mario, mariio, fut, fifa, futdraft, draft, plantilla, discard, challenge, pack, opening, handicap, pc, español, trucos, spain, spanish, el camino, MODO HISTORIA, PS5, PS4, ea sports fc, kings league, kings league oficial, ultimate mostoles, fc 25 modo carrera, fifa 25 modo carrera, fc 25 ultimate team, fc 25 gratis, fc 25 nintento switch, fut 25, fifa 25, 25, ea sports fc 25, fifa 25 ps4, fc 25 ps4, fc 25 djmariio, fc 26, ea sports fc 26, la cobra, debates",20286,hd,false,True,347463,4846,35
85ETxUOFnfM,2025-12-04T18:00:06Z,Danny Ocean - Me Rehúso (Letra),Caribeo,22,People & Blogs,,206,hd,false,True,379996,535,5
oWkee4nu1Lg,2025-12-04T21:06:49Z,El Caballero de los Siete Reinos | Tráiler | HBO Max,HBO Max España,22,People & Blogs,,124,hd,false,False,57935,953,79
q_JuxAy4v8g,2025-12-05T16:57:08Z,DESMENTÍ 77 MITOS DEL CAPITULO 7 DE FORTNITE,Hiper,20,Gaming,"fortnite, fortnite og, fornait, fornite, epic, epic games, hyper, hiper, skin, top 10, skins, estereotipos, esteriotipos, eseriotipos, mitos, mito, problemas, isla, resumen, mítica, mapa, creativo, minijuegos, meme, evento, event, marvel, retos, logros, mitos hiper, simpsons, homero, homer, capitulo 7, zero hour, kill, bill, capitulo 7 hiper, pacific break, regreso al futuro, back to the future, volver al future, mcfly, doc, brown, los siete, the seven, lore, TLR, lisa, 7.1, godzilla, kong, the rock, la roca",1563,hd,false,True,340960,8870,178
6FT7hEbU9qo,2025-12-04T22:59:06Z,"Obed Hernández, Josue Rarujo - Noche En Vela (Vídeo Oficial)",OBED HERNANDEZ Oficial,10,Music,"josuerarujo, obed, los yakys, te querio, elrarujo, josue, obedyakys, Obed Hernandez, Obed Hernandez Mentio, Obed Fermandez Mentío, Obed Hernandez x Josue Rarujo Mentío, Obed Hernandez x Josue Rarujo Mentio, mentío, mentio, josue rarujo, josue rarujo quiera dios, josue rarujo 2024, josue rarujo el corazón mío te llora, josue rarujo nos dejó, josue rarujo traiciones, josue rarujo tu amor es mio, josue rarujo miedo al amor, rarujo el corazón, rarujo el corazon, mentío obed x rarujo",239,hd,false,False,46141,1348,34
pROx0N1gHwE,2025-12-04T02:31:23Z,La Reina del Flow 3 | Tráiler Oficial - Muy Pronto,Caracol Televisión,24,Entertainment,"Caracol Tv, Caracol Televisión, Caracol en vivo, Programas Caracol, caracol televisión, caracol tv, la reina del flow 3 trailer, la reina del flow 3 trailer oficial, LRDF 3 trailer, la reina de l flow 3 avance, la reina del flow 3 nueva temporada, la reina del flow nueva temporada, la reina del flow 3 temporada",201,hd,false,True,264495,9404,450
cWCoNBY97Eg,2025-12-05T16:15:51Z,CLASH ROYALE NOS REGALA UN HEROE🤑,BENIJU,20,Gaming,"Clash Royale, Clash Royale Español, BENIJU, beniju, subir copas, guia de mazos, mejores mazos, beniyu, bniju, benju, TV ROYALE, TV ROYALE EN ESPAÑOL, JEFA BANDIDA, VERDUGO EVO, NUEVA EVO, NUEVA ACTU, CLASH ACTU, ken, tv royale, tv royale en español, nueva carta, nueva evo, modo ranked",1280,hd,false,True,470883,22754,1396
oFgRyq6ZRLg,2025-12-04T12:00:06Z,"HAZE - BLANCA NAVIDAD ft. BUBY, BELÉN PEÑA [Prod. by RAÚL NADAL]",HAZE,10,Music,"HAZE, RAP, FLAMENCO, URBANO, SEVILLA, haze, blanca navidad, navidad, blanca navidad haze, haze blanca navidad, buby, belen peña, raul nadal, buby navidad, belen peña navidad, prod raul nadal, raul nadal navidad, feliz navidad, ophion",198,hd,false,True,72390,4354,443
avtunpP2a9M,2025-12-04T00:00:01Z,El Gran Diluvio | Tráiler oficial | Netflix,Netflix Latinoamérica,24,Entertainment,"Corea del Sur, El Gran Diluvio, Kim Da-mi, Netflix, Park Hae-soo, SF, The Great Flood, acción, blockbuster, catástrofe, ciencia ficción, desastre, diciembre, director Kim Byung-woo, estreno, nuevo lanzamiento, películas coreanas, sci-fi, taquillazo, una película de Netflix",124,hd,false,False,449070,4637,160
NTWNeB1auhQ,2025-12-04T20:15:32Z,💀 HARDCORE SURVIVAL ft el mejor YouTuber de la historia: yo ,Auron,20,Gaming,"Auron, AuronPlay",3620,hd,false,True,417477,22101,636
dDwoyrVcbEo,2025-12-05T06:00:06Z,Alex Torres X Luis R Conriquez X Anuel AA - Por Si Se Les Olvidaba (REMIX) [Video Oficial],Alex Torres,10,Music,"alex torres, alex torres oficial, alex torres musica, alex torres videos, regional mexicano, sierreño, música mexicana, luis r conriquez, anuel aa, por si se les olvidaba, por si se les olvidaba remix, alex torres por si se les olvidaba remix, alex torres por si se les olvidaba remix video, alex torres por si se les olvidaba remix video oficial, alex torres por si se les olvidana remix oficial, luis r conriquez oficial, luis r conriquez musica, luis r conriquez canciones",179,hd,false,False,500617,37970,1914
yzGMPnav4MU,2025-12-04T10:01:46Z,Série - Marie & Momo - Episodes 33 - 34 - Bande annonce,Marodi TV Sénégal,24,Entertainment,"Séries, Série, télévisions, sénégal, séries sénégalaises, marodi tv, Marodi, séries africaines, mbarodi, vidéos sénégal, karma, maitresse, pod et marichou, decheance, virginie, emprises, credule, baabel, kay&za",68,hd,false,True,320111,12547,90
b9bm1eNPb-M,2025-12-04T17:01:06Z,Me toca,AlphaSniper97,24,Entertainment,"call of duty, activision, alphasniper, alphasniper97, black ops 7, me toca, alphasniper polemica, polemica alphasniper97",5468,hd,false,True,175017,12047,3292
tX1HXolYQ5o,2025-12-03T19:58:07Z,Cyril Kamer - Annabelle (Video Oficial),Cyril Kamer,10,Music,"Jul, Afro, Trap, Cyril, Kamer, CyrilKamer, Omar, Montes, OmarMontes, RVFV, JC REYES, SAIKO, MORAD, BENYJR, MDLR, 22 LOS REBELDES, Cinderella, Zendaya, Thalia, lOCO, QUEVEDO, MORA, FEID, DEIV, HADES66, AFRO ESPAÑA, KG970, PATRON970, KIDDKEO, JUL, VEGEDREAM, NISKA, GAZO, AIMANJR, clarent, sch, bad gyal, quevedo, yapi, alu",162,hd,false,True,110286,8178,314
IaEtA56pd_w,2025-12-05T20:48:18Z,Iron Lung: Final Trailer,Markiplier,20,Gaming,"markiplier, iron lung, iron lung movie, official trailer, movie trailer, iron lung trailer 3, final trailer, iron lung release date, iron lung markiplier, Caroline Kaplan, troy baker",105,hd,false,False,2084361,325031,16820
gIiR8S0veu4,2025-12-05T17:30:28Z,¿Cuánto sabes de Minecraft? Mikecrack y ElRichMC,ElRichMC - Minecraft & Gaming a otro nivel,20,Gaming,"ElRichMC, ElRich, Rich, MC, Minecraft, videogame, gameplay, comentado, español, spanish, mikecrack, mike y rich, mikecrack y elrichmc",5360,hd,false,True,130114,16779,1040
SixTbTc6YCg,2025-12-05T17:00:06Z,"Ice Spice, Tokischa - Thootie",IceSpiceVEVO,10,Music,"Ice Spice, Tokischa, 10K Projects/Capitol Records, Hip Hop",153,hd,true,True,516179,48819,2663
b-yiTAKbCKc,2025-12-04T22:00:47Z,"Warhammer 40,000: Dawn of War IV Story Trailer | Warhammer",Warhammer,20,Gaming,"Games Workshop, Citadel Miniatures, Warhammer Age of Sigmar, Warhammer 40000, Forge World, Black Library, 40K, AoS, GW, Astartes, Space marine, Tow, The Old world, Middle earth strategy battle game, lord of the rings, the hobbit, warhammer underworlds, necromunda, the horus heresy, legions imperialis, age of darkness, total war, space marine, space marine 2, Warhammer Fantasy",144,hd,true,False,729829,42806,3341
APJ-lT0sBhg,2025-12-05T14:56:45Z,GTA Online: A Safehouse in the Hills Coming December 10,Rockstar Games,20,Gaming,"GTA Online, GTAV, GTA5 Online, GTA 5, GTA Online Update, A Safehouse in the Hills, PS5, PS4, PlayStation 5, PlayStation 4, Xbox Series X|S, Xbox One, PC, Mansions, Michael De Santa",61,hd,true,True,1219873,104146,9073
ZbLY8C1xw14,2025-12-04T23:00:07Z,Estopa - VILLA & ZIKO (Video Oficial),EstopaVEVO,10,Music,"Cheerful, Estopa, Happy, Latin Christmas, Navidad, Single, Upbeat, VILLA ZIKO, Villancicos, Wild",171,hd,false,True,71442,4566,200
sItUCKJQLTU,2025-12-04T20:53:14Z,A Knight of the Seven Kingdoms | Official Final Trailer | HBO Max,HBO Max,24,Entertainment,"hbo max, ser duncan the tall, a knight of the seven kingdoms hbo, george r.r. martin, dunk and egg, a knight of the seven kingdoms hbo max, a knight of the seven kingdoms trailer hbo, game of thrones, peter claffey, dexter ansell, a knight of the seven kingdoms trailer, dunk, egg, westeros, a song of ice and fire, house targaryen, game of thrones new series, a knight of the seven kingdoms game of thones, GoT, game of thrones new show, peter claffey dunk, finn bennett, knight, AKOTSK",152,hd,true,True,5581758,56653,3727
V7wdMRFNaCk,2025-12-03T20:10:30Z,AAAAAAAAAAA,TheGrefg,20,Gaming,"mi primera victoria, capítulo 7, fortnite, mi skin, que se parece a, thegrefg, grefg",1451,hd,false,True,1013429,44554,1008
AJafSQWPnnA,2025-12-04T23:00:06Z,"JUSEPH, SAIKO | FELINASS (Video Oficial) | LOS DEL GLAMOÜR",Juseph,10,Music,"juseph, juseph 2024, juseph videoclip, saiko, felinas, felinass, felinasss, saiko felinas, juseph felinas, los del glamour, glamour, juseph saiko, saiko juseph, lpdgc",194,hd,false,True,43157,3397,134
qFKhUJTnC-E,2025-12-04T16:44:01Z,Total War: MEDIEVAL III - Announce Trailer,Total War,20,Gaming,"Total War, warhammer, total war warhammer, rome total war, warhammer 2 total war, total war rome 2, medieval total war, medieval total war 2, three kingdoms total war, total war gameplay, shogun 2 total war, total war saga, total war warhammer gameplay, 3 kingdoms, new, gameplay, trailer, warhammer 3, total war warhammer 3, Total War PHARAOH, pharaoh, total war deep dive, deep dive, gameplay showcase, total war gameplay showcase",94,hd,true,False,511776,34565,5349
popKvtrgDBc,2025-12-05T19:43:34Z,Volví a competir en Fortnite después de AÑOS,Peereira7,20,Gaming,"heretics peereira, fortnite arena, peereira, peereira7, peereira fortnite, peereira7 fortnite, pepe fortnite, peereira7 fncs, pereira7 fncs, fortnite, reaccionando, pereira, pepe, heretics, peereira reacciona",899,hd,false,True,49589,1941,23
2yGZPCjtGJ8,2025-12-05T00:00:08Z,Paulo Londra - 1% (feat. Eladio Carrión) [Official Video],Paulo Londra,10,Music,"Paulo Londra, Eladio Carrión, Eladio Carrion, Boxeo, Laveladadelaño, Paulo Londra nuevo video, Eladio Carrión nuevo tema, Paulo Londra videoclip oficial, latin trap, trap latino, urban latin, hip hop latino, rap latino, reggaeton trap, música urbana, Bad Bunny, Anuel AA, Myke Towers, Feid, Duki, Nicki Nicole, Trueno, Bizarrap, YSY A, Neo Pistea, Tiago PZK, Cazzu, Rauw Alejandro, J Balvin, Karol G, Mora, Quevedo, Nicky Jam, Ñengo Flow, Arcángel, Young Miko, milo j",244,hd,false,True,678332,87450,4680
zNSOjQPgk_k,2025-12-04T22:55:42Z,'Line of Contact' Update Trailer / War Thunder,War Thunder. Official channel.,20,Gaming,"war thunder, wt, war thunder update, war thunder trailer, trailer, update",214,hd,true,False,514213,43433,5458
ViqnRwrdSIU,2025-12-05T20:25:18Z,Pokémon X MegaLocke 5 Ep.12 - ¡1 VIDA!,Folagor03,20,Gaming,"fola, folagor, folagor03, pokemon, dedsafio, randomlocke",12934,hd,false,True,81782,4631,187
OfpaUiaSNoc,2025-12-05T00:00:06Z,"Carla Morrison, Pablo Alborán - Si Te Quedas (Official Video)",CarlaMorrisonVEVO,10,Music,"carla morrison, pablo alboran, carla morrison pablo alboran, si te quedas carla morrison, si te quedas letra carla morrison pablo alboran, carla morrison 2025, pop latino 2025, pablo alboran 2025, Carla Morrison Pablo Alborán, Latin Pop, Loving, Si Te Quedas",177,hd,false,True,237815,17843,736
pyS909TVyQY,2025-12-04T14:01:35Z,The God Slayer - Gameplay Trailer | PS5 Games,PlayStation,20,Gaming,"PlayStation, PS5, video games, next gen, Sony, the god slayer, gameplay, gameplay video, celestials, gods, steampunk, asian steampunk, RPG game, Steampunk, Reveal trailer, Open World RPG, Elemental combat game, Fantasy RPG Playstation, New Playstation games 2026, Single player RPG, Next gen RPG, avatar, RPG, fantasy, Story driven RPG, The God Slayer trailer, Final Fantasy, Celestial, pathea games, qi, martial arts, divine, energy, god fall, eastern, water, fire, metal, earth, wood",459,hd,false,True,1018261,49116,3840
_L5NTP2hviE,2025-12-05T22:46:51Z,Usé SUERTE INFINITA en 2 FILAS de COMIDA VS BEBIDA en Steal a Brainrot,SoyNeto,20,Gaming,"roblox, steal a brainrot, brainrot, roba un brainrot, brainrot roblox, brainrot secreto, base brainrot, soyneto, nueva base, flex roblox, 2 FILAS ADMIN, SERVER ADMIN STEAL A BRAINROT, 2 PASARELAS STEAL A BRAINROT, HACKS STEAL A BRAINROT, TRUCOS STEAL A BRAINROT",1953,hd,false,True,577358,6241,610
nrHvV1DD5yw,2025-12-03T22:24:01Z,"ZETAK – ""Aralarko Dama"" (La Revuelta – 2025) HD",RTVE Música,10,Music,"RTVE, Musica, RTVE Musica, canal, actuacion, directo, videos",203,hd,false,True,105593,2393,311
3_bgwLEEqkk,2025-12-04T18:59:44Z,¡Tráiler de SUPERGIRL! ¡SCARLETT JOHANSSON en THE BATMAN 2!  y ¿JAMES GUNN FUERA? 🚨,"Strip Marvel I Marvel, DC & Superhéroes",1,Film & Animation,"marvel, comic con, marvel phase 5, marvel phase 6, avengers, secret wars, kang dynasty, captain america new world order, black panther, kang, guardians of the galaxy, she-hulk, wakanda forever, namor, fantastic four, thunderbolts, daredevil, FASE 5, FASE 4 MARVEL, FASE 5 MARVEL, FASE 6 MARVEL, avengers secret wars, avengers kang dynasty, vengadores dinastia de kang, kevin feige, noticias marvel, actualidad marvel, trailer avengers kang dinasty, trailer avengers secret wars",1331,hd,false,True,21982,1774,99
m9kxfDPadJY,2025-12-05T19:53:11Z,JUGAMOS una TORRE TROLL de NAVIDAD en Roblox con Mandarina,Lyna,20,Gaming,,875,hd,false,True,440509,5800,519
LEz_eHbD15w,2025-12-02T23:00:31Z,Beéle - si te pillara (LETRA),FlowVerso,10,Music,,184,hd,false,True,130709,109,2
Gpz_oWbfhLc,2025-12-05T16:00:28Z,Mi Primer Tren - Ingeniero Descubre Create Mod Dia 12,Rubik,20,Gaming,"Minecraft, Redstone, Rubik",1423,hd,false,True,85112,9185,216
n6Dl684PiIE,2025-12-04T23:00:06Z,”ESTRELLES” – MAX NAVARRO,Operación Triunfo Oficial,24,Entertainment,"estrelles, single, jmax navarro, single max, single max navarro, ot2025, operación triunfo, ot, ot 2025, ot25, prime video",200,hd,false,True,41615,4207,386
ljXA_ZPTQJ0,2025-12-05T19:01:01Z,Mi Amigo Me ROBÓ Mi Casa en Minecraft!,Trolero,20,Gaming,"trolerotutos, trolero, minecraft, trolerotutos aleatorio, trolerotutos minecraft, minecraft trolerotutos, Trolerotutos, hardy, trolardy, trolero y hardy, libro trolardy, Trolero, Minecraft, me robó la casa, troll Minecraft, robo Minecraft, trolero juega, Minecraft español, Minecraft divertido, Minecraft locuras, casa robada, prank Minecraft, survival Minecraft, guerra de casas, trolleo Minecraft, construcción Minecraft",1012,hd,false,True,131277,1824,91
iTTBqm6rVRs,2025-12-02T01:48:24Z,Labios Compartidos - Maná (Letra/Lyrics),Rock Soul,24,Entertainment,"Labios Compartidos, Maná, Labios Compartidos Maná, Labios Compartidos letra, Labios Compartidos lyrics, Maná letra, Maná lyrics, rock latino, rock en español, pop rock, Maná hits, música romántica, canción icónica, Maná oficial, canción para dedicar, música en español, Musicana, rock mexicano, balada rock, música legendaria, rock clásico latino, canción nostálgica, éxitos de Maná, himnos del rock, música para enamorados, baladas poderosas, Maná en vivo",316,hd,false,True,317237,454,5
aeTFL8Gf4eY,2025-12-05T18:39:16Z,Probando LUCKY BLOCKS y Seguimos con MANSION! (MINECRAFT SURVIVAL en DIOSESMC) #30,VEGETTA777,20,Gaming,"minecraft survival vegetta777, vegetta777 diosesmc, diosesmc vegetta777, minecraft survival diosesmc, tutorial diosesmc, servidor minecraft vegetta777, serie minecraft, serie minecraft vegetta777, minecraft vegetta777, minecraft, series suscriptores, serie suscriptores, minecraft dioses mc supervivencia vegetta777, minecraft dioses mc serie supervivencia, minecraft dioses mc serie minecraft, videojuego serie vegetta, serie vegetta777 superviviencia, minecraft dioses mc capitulo",12366,hd,false,True,156548,10687,105
an9-ab0-3ZE,2025-12-05T05:00:17Z,"Ozuna, Beéle - Ale (Visualizer)",Ozuna,10,Music,"Reggaeton music, musica, reggaeton, top reggaeton hits, Ozuna, El negrito ojos claro, nuevo reggaeton, ozuna musica, ozuna hits, musica nueva, ozuna, urbano latino, audio official, Ozutochi, Nuevo Album, COSMO, OZUNA, nuevo de Ozuna, official video, New music",131,hd,false,False,111239,4906,249
Pq_ZYw3YmQA,2025-12-04T08:14:23Z,Mecha Girls to the Rescue! (New Season),Brawl Stars,20,Gaming,"brawl stars, mobile game, mobile strategy game, mobile rpg, mobile battle royale, battle royale, supercell game, brawl animation, mecha, mechas, mechmas, mechmas season, season, new season, new brawl season, animations",52,hd,true,True,2738983,53145,1984
AJNwATS0H20,2025-12-05T00:00:07Z,"Justin Quiles, Lenny Tavárez, Blessd - LAS NEAS (Video Oficial)",Justin Quiles,10,Music,"Justin Quiles, J Quiles, lenny tavarez, blessd, las neas, las neas justin quiles, las neas blessd, las neas jquiles, las neas lenny tavarez, lo nuevo de jquiles, lo nuevo de lenny tavarez, lo nuevo de blessd, las neas justin quiles lenny tavarez blessd, ovy on the drums, lo nuevo de ovy on the drums",205,hd,false,True,231457,14178,434
XmBmY5ROv9A,2025-12-03T14:15:04Z,LOS REYES DEL CAPÍTULO 7 DE FORTNITE 🏄‍♂️ - Fortnite ft. Andrés,IlloJuan,20,Gaming,"illojuan, mejores momentos illojuan, clips illojuan, illojuan clips, twitch illojuan, illojuan directo, lmdshow, ldmshow, mejores momentos de illojuan",9138,hd,false,True,153711,5730,168
X48WUb1c29Q,2025-12-05T00:00:05Z,Juanka x Myke Towers – Santa Diabla Remix (Video Oficial),Juanka El Problematik,10,Music,"Juanka, Myke Towers, Santa Diabla Remix, Santa Diabla Juanka, Santa Diabla Myke Towers, Juanka Myke Towers, Juanka y Myke Towers,
Trascendencia Juanka, Reggaeton 2025, Perreo 2025, 
Reggaeton Colombia, Juanka El Problematik. 
Myke Towers remix, Nueva música urbana, Latin urban 2025",211,hd,false,True,385213,29405,609
