video_id,published_at,title,channel_title,category_id,category_name,tags,duration,definition,caption_available,licensed_content,views,likes,comments
4MehTsaY0sE,2025-12-04T23:02:12Z,Bik wala bla bik - Cheb Rami,Cheb Rami - Topic,10,Music,"Cheb Rami, Bik wala bla bik",262,hd,false,True,48039,498,0
XRRnP91SSrQ,2025-12-05T16:00:21Z,Welcome Home | Poppy Playtime Chapter 5 Cinematic Trailer,Mob Entertainment,20,Gaming,,58,hd,true,True,1787749,161204,11922
FBOcQF6CVS4,2025-12-06T11:00:26Z,ุฌุงุฑููุง ุงุนุทุชูู ูุฏุงูุง ุฌุฏูุฏุฉ !!,SA7RAWI,20,Gaming,"ุงูุตุญุฑุงูู, ุตุญุฑุงูู ูุฑู ูุงูุฑ, sa7rawi, ูุฑู ูุงูุฑ, ุตุญุฑุงูู, ูุฑู ูุงูุฑ ุงูุฌุฒุงุฆุฑ, ุชูููุฑ ูุฑู ูุงูุฑ, ุชุญุฏู ูุฑู ูุงูุฑ, ูููุจ ุงูููุจ, ุดุญูุชููู, ุดุญู ูุฑู ูุงูุฑ, ุฃูู ุฌููุฑุฉ, ุชุฎุฑูุจ ุญุณุงุจ, ุดุญูุช ูููุชุงุจุน, ุชุญุฏู ุฃููุฒ, FREE FIRE, NOOB PRANK, ุณููุงุฏ ุฌุฒุงุฆุฑู, ุฎุฏุนุฉ ุงููุบู, ุณุงููุฑุง, ุงูุชุญุฏูุซ ุงูุฌุฏูุฏ ูุฑู ูุงูุฑ, WHITE444, ููุฏุดูุช ุชููุงุฆู, ุญุณููุฉ, ุฏุฑุงุบูููู, DBL N, ุงูุดุฎุตูุฉ ุงูุฌุฏูุฏุฉ, ูุชุฌุฑ ุงูุชุฎููุถุงุช, ุงูุณูู, ุงูุดูุชูู, ูุฑู ูุงูุฑ ูุงูุช, ุงููุฑูููุงู, ุงููุงูุฑ ุจุงุณ ุงูุงูู, ุงููุชุงุจุนูู, ุงุตุนุจ ุชุญุฏู, Ali Omar, M16, TRYHARD, DJEXO, ููู ุจูุงู, ุณููุงุฏ ุจูุงุช",745,hd,false,True,118163,12408,1322
Smzmqx2U67k,2025-12-04T16:00:07Z,Cheb Walid 2026 | ุฏุงุฑูููุง ุฒูููุฑ ูุนููููุง ุดููู Ya Hren Mabghach Ykatef ยฉ Ft Zaki Japoni ( Vidรฉo Clip ),AMINE PROD,10,Music,,235,hd,false,True,110168,2512,164
VI6XO8EijT4,2025-12-05T20:00:28Z,DIGITAL CIRCUS EP 7 TRAILER!!,GLITCH,1,Film & Animation,"glitch, glitch productions, digital circus, the amazing digital circus, murder drones, Pomni, Uzi, Jax, Ragatha, Kinger, Gangle, Zooble, Caine, Bubble, 3D, Animation, 3D Animation, Indie Animation, Gummigoo",58,hd,true,True,4246050,432090,25502
raLo9_S6JRY,2025-12-06T07:22:25Z,Playing as EVERYONE Mix Family Horror: Squid Game Chucky Army vs Spider Baby Team in Granny House,Funny TungTung Plus4D,22,People & Blogs,,1119,hd,false,True,206387,6082,157
k_IN-MQDLGs,2025-12-05T17:00:08Z,Prince Polo - Dreri ( Official Music Video),Prince Polo,10,Music,,184,hd,false,True,29922,3215,261
IaEtA56pd_w,2025-12-05T20:48:18Z,Iron Lung: Final Trailer,Markiplier,20,Gaming,"markiplier, iron lung, iron lung movie, official trailer, movie trailer, iron lung trailer 3, final trailer, iron lung release date, iron lung markiplier, Caroline Kaplan, troy baker",105,hd,false,False,2084361,324977,16819
euhJ-9h584Y,2025-12-06T05:12:35Z,Long Slide Game With Cow Elephant Gorilla Hippopotamus Tiger 3d Animal Game Funny 3d Animals,Flygame Animals,1,Film & Animation,,648,hd,false,True,736616,8393,190
ktTNuLQS3jg,2025-12-04T17:39:33Z,Cheb ALi Madjadji Ft Dido 2026 Mazal Liyam Dor wl HaQ Yban ูุงุฒุงู ููุงู ุฏูุฑย ููุญู ูุจุงู (OFFICIEL CLIP),DJ TaJiou Official,10,Music,"3la Fra9ek Maghadi Nahzen, Cheb Adjel - Men Ghir Ma Ma Tabghini Hta Mra, Cheb Ali Madjadji, Cheb Ali Madjadji jadid, Cheb Lotfi 2023, Cheikh Krimo Saidi - Sekertah China, Djamel Sghir Barman Zid Ou Jib, Remix Hbeeeel gasb, Remix rai jdid, Thalay F 3asakri, jadid Ch",304,hd,false,True,52342,1718,180
UdwMvsJloXM,2025-12-06T11:30:35Z,ุญูุงุชู ูู ูุดุฑุฏ ูููุฑ ุฅูู ููููููุฑ ุฃุณุทูุฑู ูู ูุฑูุฉ ูุงูู ูุฑุงูุช !!ุ,PMN Extra,20,Gaming,,2188,hd,false,True,74190,3756,264
xtMRhVLB1X4,2025-12-03T10:01:43Z,ุจูู ููุง ุจูุง ุจูู,Cheb Rami - Topic,10,Music,"Cheb Rami, ุจูู ููุง ุจูุง ุจูู",259,hd,false,True,96023,962,18
A74BuBS0g0w,2025-12-05T14:00:17Z,ูุฌุฏุช ุฎุฏุนุฉ ุณุฑูุฉ ุฌุฏุง !!,SA7RAWI Gaming,20,Gaming,"ุงูุตุญุฑุงูู, ุตุญุฑุงูู ูุฑู ูุงูุฑ, sa7rawi, ูุฑู ูุงูุฑ, ุตุญุฑุงูู, ูุฑู ูุงูุฑ ุงูุฌุฒุงุฆุฑ, ุชูููุฑ ูุฑู ูุงูุฑ, ุชุญุฏู ูุฑู ูุงูุฑ, ูููุจ ุงูููุจ, ุดุญูุชููู, ุดุญู ูุฑู ูุงูุฑ, ุฃูู ุฌููุฑุฉ, ุชุฎุฑูุจ ุญุณุงุจ, ุดุญูุช ูููุชุงุจุน, ุชุญุฏู ุฃููุฒ, FREE FIRE, NOOB PRANK, ุณููุงุฏ ุฌุฒุงุฆุฑู, ุฎุฏุนุฉ ุงููุบู, ุณุงููุฑุง, ุงูุชุญุฏูุซ ุงูุฌุฏูุฏ ูุฑู ูุงูุฑ, WHITE444, ููุฏุดูุช ุชููุงุฆู, ุญุณููุฉ, ุฏุฑุงุบูููู, DBL N, ุงูุดุฎุตูุฉ ุงูุฌุฏูุฏุฉ, ูุชุฌุฑ ุงูุชุฎููุถุงุช, ุงูุณูู, ุงูุดูุชูู, ูุฑู ูุงูุฑ ูุงูุช, ุงููุฑูููุงู, ุงููุงูุฑ ุจุงุณ ุงูุงูู, ุงููุชุงุจุนูู, ุงุตุนุจ ุชุญุฏู, Ali Omar, M16, TRYHARD, DJEXO, ููู ุจูุงู, ุณููุงุฏ ุจูุงุช",581,hd,false,True,109820,8618,538
N9BWgW4W3_0,2025-12-05T21:49:10Z,ูุงุฒุงู ููุงู ุฏูุฑ ููุญู ูุจุงู,Cheb Ali Madjadji OfficiaL - Topic,10,Music,"cheb ali madjadji, ูุงุฒุงู ููุงู ุฏูุฑ ููุญู ูุจุงู",304,hd,false,True,3294,63,1
PpX-8icr5KA,2025-12-06T11:00:49Z,ุงุดุชุฑูุช ุงูุฒุจุงูุฉ ุดูู ูุด ูููุช !!,ุดุจูุฉ ุงูุนุงุจ ุงูุนุฑุจ | Arab Games Network,20,Gaming,,1423,hd,false,True,96460,6225,521
jFRte1Eo7do,2025-12-03T15:30:11Z,Bilal babilo Feat Yousri Oscar- Psycho_love Ntiya   -[ ููููุจู ุฏูููุชููู }Exclusive Clip Officiel,Bilal Babilo | ุจูุงู ุจุงุจููู,10,Music,,284,hd,false,True,171631,4285,224
t-EFtiAOctM,2025-12-05T21:11:24Z,ุฃุฎูุฑุงูุงุง ุฃูููุณ ุจููุชุฒ ููุฑูุฑ 102.. ุงููู ุดูุชุงูู ูุฌุงูู๐ฅ๐คฏ ุตุฏููู ุงูR2 ุจุชุงุนู ๐ฑ! eFootball 26,MessiGaming10,20,Gaming,"ุจูุณ 2026 ููุจุงูู, ุจูุณ ููุจุงูู ุงูููู, ููุณู ุฌูููุฌ, messigmaing, ุชูุฌูุฑ ุจูุฌุงุช ุจูุณ, ุชูุฌูุฑ ุจูุฌ ูุฌูู ุงูุงุณุจูุน ุงูุฌุฏูุฏ, ุชูุฌูุฑ ุจูุฌ ุงูุงุซููู ุงูุฌุฏูุฏ, ุจูุฌ ุงูุงุจุทุงู, ุชุญุฏูุซ ุงูููุณู, eFootball 2026, ุชุญุฏูุซ ุจูุณ 26 ููุจุงูู, ุงููู ุชุดูููู ูู ุจูุณ 26, ุชูุฒูู ุงู ููุชุจูู 26 ููุจูู, ุงู ููุชุจูู 26 ุงูุฌุฏูุฏู, review new Blitz Curler efootball 2026, efootball 2026, ุดุฑุญ ุงูููุงุฑุงุช ุจูุณ26, ุชูุฌูุฑ ุจูุฌ ููุณู ุงูุฌุฏูุฏ, review Michael Olise bulitz, ุชุฌุฑุจู ุงูููุณ ุงูุจูุชูุฒ ููุฑูุฑ ุงูุฌุฏูุฏ ูู ุงู ููุชุจูู, ุงููู R2 ูู ุงูุนุจู, ุงููู ุจููุชุฒ ูุฌุงูู",922,hd,false,True,124542,12291,1828
tt7lYYzWAVo,2025-12-05T15:11:10Z,JuL - BDR // Clip Officiel // 2025,DORETDEPLATINE,10,Music,"JUL, juldetp, jul saint jean, d'or et de platine, doretdeplatine, tp sur tp, double album, 2025, BDR, Rap, jul qui rap",354,hd,false,True,279710,16093,1269
Xu_U6fd7zvQ,2025-12-05T12:01:14Z,VIDA de IRON GOLEM no Minecraft!,Cadres,20,Gaming,,1257,hd,false,True,1598952,11654,118
r4L5EmGTuiY,2025-12-03T17:01:40Z,Bilal Sghir (Galbi ta3ak - ููุจู ุชุงุนู) par @Harmonie.edition new song 2026,Bilal Sghir l ุจูุงู ุตุบูุฑ,10,Music,"Galbi ta3ak, ููุจู ุชุงุนู, ฺจูุจู ุชุงุนู, Galbi taak, Bilal Sghir Sghir, Bilal sgir 2026, Chab Bilal Sghir, Jdid Bilal Sghir, Clip Bilal Sghir, ุจูุงู ุงูุตุบูุฑ, ุงูุดุงุจ ุจูุงู ุงูุตุบูุฑ",291,hd,false,True,164674,4619,530
wap01nb744o,2025-12-06T12:01:56Z,ุฌุฑุจุช ุงูุตูุงุฑูุฎ ุนูู ุงููุงุณ! ๐ฑ ูุงููุฌุฑุช ุงูุนูุงุฑุฉ ุจุงูุบูุท! ๐ญ๐ฅ | Newtonโs Playground VR,ุจุทุงุทุง,20,Gaming,"newtons playground, ูููุชูุฒ ุจูุงู ูุฑุงููุฏ, ูุนุจุฉ ูููุชู, ุณุฑูุฉ ุทูุงุฑุฉ, ุฑููุช ุงูุทูุงุฑ, ุงูุนุงุจ ููุฒูุงุฆูุฉ, ููุงุทุน ูุถุญูุฉ, ููุทุน ุณุนูุฏู, ุงูุนุงุจ ูุงูุนูุฉ, ุทูุฑุงู ูุฌููู, ุฌููููู ุณุนูุฏู, ููุชููุจุฑ ุณุนูุฏู, ุถุญู, ุงูุชุญุงู ุทูุงุฑุฉ, ุณุฑูุช ุงูุทูุงุฑุฉ, ุทุญุช ุงูุทูุงุฑ, ููุฒูุงุก ุงูุทูุฑุงู, ูุบุงูุฑุฉ ุทูุฑุงู, ููุทุน ูุฌููู, ูููุจ ุงูุทูุงุฑ, newtons playground funny, ุณุฑูุฉ ุงูุทูุงุฑุฉ, ุฑูู ุงูุทูุงุฑ, ุฃูุนุงุจ ุฌุฏูุฏุฉ, ููุงุทุน ุณุนูุฏููู, ูุญุชูู ุณุนูุฏู, ูุนุจุฉ ููุฒูุงุฆูุฉ",904,hd,false,True,32172,1497,49
BlKrlQY0I_E,2025-12-02T15:00:06Z,Faycal cholรฉ Feat Tchikou22 - Normalement Nti Tkatfini,Tchikou 22,10,Music,,302,hd,false,True,442050,9315,239
AJSF5EdLRV4,2025-12-05T13:49:08Z,ููู ูุฑุงูุฏ : ุงุญูุฏ ูุณุชุฎุจุฆ ูู ุฒุนุฑูุฑ ุชุญุช ุงูุงุฑุถ ู ุฒุนุฑูุฑ ุณูู ูุฏูุฑ ุงููุฏููุฉ ๐ฅ๐,Ahmad GTA Family - ุนุงุฆูุฉ ุงุญูุฏ ูุฑุงูุฏ ,22,People & Blogs,"ูุตุทูู GAME OVER, Mr GG, ูุฑุงูุชุฑ - Crafter, XTREEM - ุงูุณุชุฑูู, ุงููุง - OKA, AboFlah, Mkamel GG, ุฑุงููุง ููููู Rania Gaming, BOZEX, ูุงุฑุฏูู | hardlk, ุงููุงู, ูุงูู ูุฑุงูุช, ููู ูุงูู ูุฑุงูุช, ุบูู ููููุฑ, ูุงูุชุฑ Fighter, ุงุจู ููู, ูุงูุชุฑ, ุงููุงู ูุงูู ูุฑุงูุช, ุงูุบูู ู ุงููููุฑ, ูููุจ, M4X5, ูุงูู, MineCraft Movie, Suhaib - ุตููุจ, ุฌูููุฏ - GLMooD, ุชุงููู Tymo, ูุงุฑุฏูู HARDLK, Ahmad M4 - ุงุญูุฏ ุงู ููุฑ, ุจุทู, Ahmad Hero - ุงุญูุฏ ุงูุจุทู, ุงุญูุฏ ููุฑู, ุณูุจูุณุฉ - Sambosa, ุฌุนุทูุท - JATOOT, ุฎุฒุงู, ุทูุฑุงู, P4GAM3R, Y9M5 \ ูุตูุฎ, ูุฑุงูุฏ",1103,hd,false,True,203465,2085,75
_YP9GR3feng,2025-12-04T16:00:07Z,"Karima Kemmache   "" Yeccur Ul """,Sirocco Records,10,Music,"MUSIC KABYLE, Numidia lezoul, TAOUS ARHAB, ammour abdenour, berbere, hassiba amrouche, kabyle de france, kabyle de kanada, mohammed allaoua, mourad guerbas, musique kabyle, musique kabyle 2023, na houria, rachid koceilla, sirocco records, slimane azem, wahab, yacine yefsa",288,hd,false,True,33194,1270,104
LGGKmChx9Gw,2025-12-05T15:47:23Z,ุนุฒูุช ูู ุงููุญูุด ูู 99 ูููุฉ ูู ุงูุบุงุจุฉ! ๐๐ณ,El Husamo X,20,Gaming,"gaming, viral, trending, horror, ุฌูููุฌ, ุชุฑูุฏ, roblox, ุฑูุจูููุณ, ูุงูู, ูุงูููุฑุงูุช, ูุงูู ูุฑุงูุช, ูุฑุงูุช, minecraft, mine craft, gta, gtav, el husamo, ุงู ุญุณุงูู, ุญุณุงูู, husamo, ุงูุญุณุงูู, elhusamo, peekaa, peeka, naruto, hope rima, rima, abo flah, flah, abo, ุงุจู ููู, ููู, ููุฉ, ุฑุนุจ, ุตุนุจ, ุชูุฑูุฒ, ูุณุชูุฒ, trend, dubai, uae, ุฏุจู, ูุฑุฉ, ูุฏู, ุงูููู, anime, simulator, ูุญุงูู, foryou",715,hd,false,True,186058,4708,395
MibVALCXeXY,2025-11-08T13:10:37Z,ููุจู ูู ููุงู ูุงูู || ูุบุฑุจู _ ูุน ุงููููุงุช ูุงููุฉ || ุชุฑูุฏ ุชูู ุชูู 2025 ,ููุงูู ุงููุฑุงุช ,22,People & Blogs,,222,hd,false,True,375368,4534,129
w0uo2RHsdsA,2025-12-05T13:30:26Z,ุงุณุฑุงุฑ ุงูุชุญุฏูุซ ุงูุฌุฏูุฏ ูุงูู ุงูููุญูุธุงุช ๐ฅ๐คฏ ุงููุชุญุงุช ุงููุฌุงููุฉ ูุฑุณุงูุฉ ุงูููู !!๐ฑ|efootball 2026,ูู ุจุฑู ุงูุชููุชุงุดุฑ,26,Howto & Style,"ูู ุจุฑู ุงูุชููุชุงุดุฑ, efootball 2025, efootball, ุจูุณ ููุจุงูู, ุจูุณ 2024, ูุฏุงูุง ูููุงูู, ุจูุณ 25, ุงุญุฏุงุซ ููู ุงูุฎููุณ ุจูุณ, ุชุญุฏูุซ ุจูุณ ููุจุงูู, ุชุญุฏูุซ ุจูุณ 2025, efootball mobile, efootball 25, ุจูุณ 2025, eFootball Updates, Gaming Headsets, ูููู ุจูุณ, ุชุญููู efootball, ุชุญููู ุจูุณ, efootball pes, pes mobile, ุชุญููู ูุนุจุฉ efootball, ุงุญุฏุงุซ ููู ุงูุฎููุณ, ุจูุฌ ูุฌูู ุงูุงุณุจูุน, ุงุถุงูุงุช ููู ุงูุฎููุณ, ุงุญุฏุงุซ ููู ุงูุงุซููู, efootball2026, efootball 26, ุจูุฌ ูุงููู ุงูููุณู, ุงูููุฒู ุจูุณ, ุงูููุณู ุจูุณ, ููู ูุตุงุฆุญ ุจูุณ",298,hd,false,True,128924,14757,1254
K1qNKFxv8z0,2025-12-01T15:56:54Z,Didine canon 16 - Toxic,Didine Canon 16 ,10,Music,,205,hd,false,True,1012471,41592,3230
sr5C9augRJU,2025-12-04T16:03:52Z,ูุฐู ุงููุนุจุฉ ุชุตุจุญ ูุฑุนุจุฉ ุฃูุซุฑ ูู ูู ูุฑุฉ ุฃุฏุฎู ุฅูููุง ๐ณ | Roblox,Tayar | ุชูุงุฑ,20,Gaming,"when the game is real roblox, ุนูุฏูุง ุชููู ุงููุนุจุฉ ุญููููุฉ, mr mix roblox, ูุณุชุฑ ูููุณ ุฑูุจูููุณ, 99 nights in the forest, 99 ููู ูู ุงูุบุงุจุฉ, ูุนุจุฉ ุงูุญุจุงุฑ ุฑูุจูููุณ, ุฑูุจูููุณ, squid game 2, ูุนุจุฉ ุงูุญุจุงุฑ, ุงุดุงุฑุฉ ุฎุถุฑุงุก ุงุดุงุฑุฉ ุญูุฑุงุก, roblox, squid game, ูุนุจุฉ ุฑูุจูููุณ ุงูุฌุฏูุฏุฉ, ุชุชุญุฑู ุชููุช, ูุนุจุฉ ุงูุญููู ุงูุญุจุงุฑ, ุงูุฏููุฉ ุฑูุจูููุณ, ุงูุนุงุจ ุฑูุจูููุณ, ููู ุฑูุจูููุณ, ูููู ูุนุจุฉ ุงูุญุจุงุฑ, ูููู ุฑูุจูููุณ, roblox ูุนุจุฉ ุงูุญุจุงุฑ, roblox shorts, squid game 3, ุฑูุจูููุณ ูุนุจุฉ ุงูุญุจุงุฑ, ุฑูุจููุณ, ุงูุบุฒุงู ุงููุฌููู, 99 ูููุฉ ูู ุงูุบุงุจุฉ",1922,hd,false,True,185509,7504,338
12ZlV4UT4Dk,2025-12-04T16:00:06Z,Amine Choupot 2025 Ghayes Cha3el Garo - ููุงุน ุนููุง ุฏุงุฑู | Avec Toufik Smahi ( Live Neptuno +),SL Prod \ Live ,10,Music,,217,hd,false,True,31097,590,12
3LPtJgCgvIU,2025-12-06T11:00:06Z,ุฑูุจูููุณ: ุญููุช ุฃูุจุฑ ููุจ ููุงูุงุช ุฅูู ููุฌู ุฐูุจ..! ๐๏ธ๐ฐ,Rahumi Extra,20,Gaming,Roblox,1323,hd,false,True,43452,3001,278
qwgnuuhwTk8,2025-12-04T10:01:28Z,Ana Nashar wnti Rakouli (feat. Manini Sahar),Cheb Nassim - Topic,10,Music,"CHEB NASSIM, Manini Sahar, Ana Nashar wnti Rakouli (feat. Manini Sahar)",296,hd,false,True,5058,145,1
nKiQZOCOOn8,2025-12-06T11:01:42Z,ุงูุฑุฌู ุงูุนููุจูุช ุงููุงุฐ ุจุงุชูุงู Spider-Man Rescue batman vs iron man vs venom funny Game GTA 5 superhero,GTA Addiction,20,Gaming,"ุงูุฃุจุทุงู ุงูุฎุงุฑููู ุนูู ุงููุถุจุงู ุฏูุงูุฉ ููุน ุฌุณุฑ ๐ดโโ๏ธ SPIDER MAN!on Motorcycle in Spiral Bridge Stunt Ri, ุงูุฃุจุทุงู ุงูุฎุงุฑููู ุนูู ุงููุถุจุงู ุฏูุงูุฉ ููุน ุฌุณุฑ, SPIDER MAN!on Motorcycle in Spiral Bridge Stunt Ri, SPIDER MAN, Motorcycle in Spiral Bridge Stunt",1335,hd,false,True,153613,61576,384
9DID0U9Ph54,2025-12-04T11:43:51Z,ุฏุงุฑูุง ุฒูุฑ ุนููุง ุดูู,Cheb Walid - Topic,10,Music,"Cheb Walid, ุฏุงุฑูุง ุฒูุฑ ุนููุง ุดูู",235,hd,false,True,22829,512,15
2riZ2Bu0HB8,2025-12-05T20:25:30Z,WORLD CUP 2026,DZBALL,17,Sports,,5773,hd,false,True,17968,490,80
_5aAi8UuToM,2025-12-05T15:00:06Z,Cheb Kader Sghire & Nidal 22 | Ta3 Rasi W Zahwani _ ุชุงุน ุฑุงุณู ู ุฒููุงูู | Clip Officiel ,Toufik Maestro,10,Music,"Cheb Kader Sghire, Cheb Kader Sghire 2025, Kader Sghire 2025, Ta3 Rasi W Zahwani, Rah harabli volant",266,hd,false,True,42453,622,84
7ro8lFzmAtU,2025-12-06T11:59:44Z,ุตุฏูุฉ ุญุฏุซ ุญูู ุฃูููุชู ๐คฏ ุฌูุงุฆุฒ ูุณุชุญููุฉ ูุฌุงูุง ๐ฅ ุฑุณุงูุชู ุฅูู ุบุงุฑููุง ๐ฅถ,ููุฑูููู - KROLO ,20,Gaming,"ุชุณุฑูุจุงุช ูุฑู ูุงูุฑ 2025, ุชุณุฑูุจุงุช ูุฑู ูุงูุฑ, ูุฏุงูุง ูุฌุงููุฉ ูุฑู ูุงูุฑ, ุฌูุงุฆุฒ ูุฌุงูุง ูุฑู ูุงูุฑ 2025, ุดุญู ุฌูุงูุฑ ูุฑู ูุงูุฑ ูุฌุงูุง 2025, ููู ุชุญุตู ุณูู ูุฑู ูุงูุฑ ูุฌุงูุง, ููู ุชุญุตู ุนูู ุฌูุงูุฑ ูุฌุงูุง ูู ูุฑู ูุงูุฑ 2025, ูุฑููู, ูุฑู ูุงูุฑ, free fire",566,hd,false,True,10147,2306,239
XlNklH46R_U,2025-11-24T14:30:53Z,Zamani,FIFA SOUND - Topic,10,Music,"FIFA SOUND, Hamad Al Khazinah, RedOne, Zamani",212,hd,false,True,48621,759,0
OXQM_R2Ncys,2025-12-06T09:56:06Z,ูุงูู ูุฑุงูุช : ุงูุง ููููููุฑ ๐ต,ูุตุทูู GAME OVER,20,Gaming,"ูุงูู ูุฑุงูุช, minecraft",968,hd,false,True,166500,25538,1826
QywHxipJhsk,2025-12-03T15:00:06Z,Amine 31 - ูุฐุง ูู ุงูุบุฑุงู - Rassi w rassha - tchiko 22 clips officiel 2025,Studio Ganfouda - ุงุณุชูุฏูู ููููุฏุฉ,10,Music,,306,hd,false,True,126314,2680,41
