video_id,published_at,title,channel_title,category_id,category_name,tags,duration,definition,caption_available,licensed_content,views,likes,comments
ALAF4AmlrBA,2025-12-05T14:04:36Z,ุงูุนูุฏุฉ ูุชุฌููุน ุงูุจุฑ ุนุฏุฏ ูู ุงูุจููุงุช ูุน ููู ุงูููุงุฑ .๐ฅ,Faza3 Gaming,20,Gaming,"free fire, free fire game, garenafreefire, free fire mobile, free fire gameplay, farming free fire, ููุชูุจุฑ ุณุฑู ููุงูู, ุณุฑู ููุงูู ูู ูุฑู ูุงูุฑ, ูุฑู ูุงูุฑ ุฏุฑุงูุง, ูุตุฉ ุณุฑูุฉ ููุงู, ููุชูุจุฑ ูุฑู ูุงูุฑ, ูุฑู ูุงูุฑ ุนุฑุจู, ูุฑู ูุงูุฑ ูุตุฑ, ูุฑู ูุงูุฑ ุงูุณุนูุฏูุฉ, ูุฑู ูุงูุฑ ุงูุนุฑุงู, ูุฑู ูุงูุฑ ุงูุฌุฒุงุฆุฑ, ูุฑู ูุงูุฑ ุชููุณ, ูุฑู ูุงูุฑ ุงููุบุฑุจ, ูุฑู ูุงูุฑ 2025, ููุชูุจุฑ ูุฑู ูุงูุฑ ูุชุตุฏุฑ, ุฃูุถู ููุชููุจุฑ ูู ูุฑู ูุงูุฑ",1260,hd,false,True,47315,7837,185
G2-b8i7tzoU,2025-12-05T10:01:55Z,ุจุงุบูุฉ ููุตูู,Cheba Safinaz - Topic,10,Music,"cheba safinaz, ุจุงุบูุฉ ููุตูู",307,hd,false,True,2125,41,0
T2Tygbq2nV8,2025-12-05T15:51:26Z,ุงูุจุญุซ ุนู ุฃููู ูุงุนุจูู ูุฌูู ุงูุฃุณุจูุน !! ๐คฏ๐ฅ ูููุช ุฃููู ุฏูุงุน ูู ุงูุจูุฌุงุช๐โ๏ธ || eFootball 26,OKATO GO,20,Gaming,"pes mobile, ุจูุณ ููุจุงูู, ุจูุณ ููุจุงูู ุชูุชูุญ ุจูุฌุงุช, ุชูุชูุญ ุจูุฌุงุช, eFootball Mobile, ุจูุณ 2023, fifa mobile, fifa ultimate team, okato go, okato, abdalaziz esam, ุนุจุฏุงูุนุฒูุฒ ุงููุงุชู, ุงููุงุชู, ูููุง ููุจุงูู, ูููุง 23, ุชุญุฏูุซ ูููุง, ุชุญุฏูุซ ุจูุณ ููุจุงูู, ุชุญุฏูุซ ูููุง ููุจุงูู, pes 2025, pes25, efootball25, efootball 25, efootball 2025, ุชูุชูุญ ุจูุฌุงุช pes, ุชูุชูุญ ุจูุฌุงุช ุจูุณ, ุงู ููุชุจูู",1306,hd,false,True,58285,4988,160
X2INt4S1EHM,2025-12-04T17:00:56Z,Rooy  -   Rani happy    (Clip Officiel),Rooy,10,Music,,149,hd,false,False,11105,1709,187
55tqsmJ8zeM,2025-12-06T09:30:00Z,Long Slide Game With Cow Elephant Gorilla Hippopotamus Tiger - 3d Animal Game - Funny 3d Animals,Animals 3D,24,Entertainment,"long slide, long slide game, funny 3d animals, animals 3d",295,hd,false,True,355735,14223,915
_exrHYI_lEg,2025-12-04T18:00:06Z,ูุฎุงูุฉ ุงูุตูุช ูู ุฃููู ุฃุบุงูู ุงูุดูุฎ ูุงูู ๐ฅ | ูููุงู ูุจุฑุช ููู ุงูุนุดุฑุฉ | ยฉ ูุงูู ุณุชูุฏูู ุชูุจู ฺคูููุฏุฉ - ุงูุนุฑุด,3orch Na3na3,10,Music,"ุงูุดูุฎ ูุงูู, cheb hasni, cheb khaled, cheb bilal, Bilal sghir, Cheb bello, chaba warda, Oran, Alger, Cheikh Krimo, France, Marseille, Algerie, ููุฑุงู, Mohamed Benchenat, ูุฑูุณุง, Maroc, nani live, cheikh nani, soolking, nani, djalil palermo, Amine La Colombe, Didine Canone, Qatar, USA, 3orch, ุงููุบุฑุจ, manini sahar, ูุทุฑ, ูุงูู, ุงูุฌุฒุงุฆุฑ, lotfi, euro, momo, mamidou, music, rai, ุฑุงู, ุงูุบุฑุจ, ุงูุดุฑู, milano, games, ุงูุนุฑุด, libya, ุชููุณ, hichem, ุชุฑููุง, ุฅุณุจุงููุง, ุฅูุทุงููุง, live, dj, remix, gasba, piano, short, love, hasni, ุญุณูู",399,hd,false,True,15874,311,22
WIpg_waj3hY,2025-12-04T18:30:14Z,ุฑุญูุฉ ุงูุจุญุซ ุนู ุนููุงู ุงูุฑุฃุณูุงุช ููููุฑ๐คฏุนูุฏุฉ ุงุณุทูุฑุฉ ุงูุฌูุชุฑุง๐ฅ|efootbal 2026,TONY GAMING,20,Gaming,"ุจูุณ ููุจุงูู, ุจูุณ ููุจุงูู 2022, ุจูุณ 2022 ููุจุงูู, ุชุญุฏูุซ ุจูุณ 2022 ููุจุงูู, ููุนุฏ ูุฒูู ุจูุณ 2022 ููุจุงูู, ููุนุฏ ุชุญุฏูุซ ุจูุณ 2022 ููุจุงูู, ููู ุงูุฎููุณ ุจูุณ 2021 ููุจุงูู, ุจูุณ 2021 ููุจุงูู ุงูููู, ุชุญุฏูุซ ุจูุณ ููุจุงูู, ููุนุฏ ุชุญุฏูุซ ุจูุณ ููุจุงูู, ููุนุฏ ุจูุณ 2022 ููุจุงูู, ุงุฎุจุงุฑ ุจูุณ 2022 ููุจุงูู, ุชุญููู ุจูุณ 2022 ููุจุงูู, ุชุญุฏูุซ ุจูุณ 2023, pes 2022, efootball 2024, ุชูุฌูุฑ ุจูุฌุงุช, ุชุญุฏูุงุช, ุงูุถู ุชุดูููู, ุงูุชุญุฏูุซ ุงูุฌุฏูุฏ, ุจูุฌ ูุฌูู ุงูุงุณุจูุน, koeman, koller, beckham, neto, ekitiki",1401,hd,false,True,171947,16985,434
fb486ZPzyq0,2025-12-03T13:00:06Z,Bilal Sghir 2025 - ุฑุงุณู ูุฑุงุณู Weld Maa Machi Kif Kif ยฉ๏ธ Avec Mito live (Cover),Himo Live 4k,10,Music,"bilal sghir, Himo 4k, mito, rai 2025, live 2025, ุฑุงุณู ูุฑุงุณู ููุฏ ูุงุง ูุงุดู ููู ููู, cover cheb bilal",247,hd,false,True,62069,591,15
KiVzL_z7NPs,2025-12-06T11:49:12Z,ูุชุญุช 100 ุณููุฑุช ูุฑูุณูุงุณ ูุงูู ุจููู ๐ค Roblox Steal a Brainrot,RTQ,20,Gaming,,557,hd,false,True,82181,4450,426
VvFZANHf788,2025-12-03T12:06:29Z,OMER DEEP - Homay (Original Mix),OMER DEEP,10,Music,"Deep House, Tik Tok, Tik Tok Remix, Remix, House, Mix, รmer Bรผkรผlmezoฤlu, รmer Balik, Omer Balik, Hayit Murat, Semicenk, Lvbelc5, lvbel5, levelc5, c5, gaz pedal, Rap, Rnb, hip hop, g-house, slap house, tropical house, arabalฤฑk ลarkฤฑlar, uzun yol ลarkฤฑlarฤฑ, Dj Valka, Night Lovell, Bones, Timberlake",377,hd,false,True,184876,1716,211
