video_id,published_at,title,channel_title,category_id,category_name,tags,duration,definition,caption_available,licensed_content,views,likes,comments
dDwoyrVcbEo,2025-12-05T06:00:06Z,Alex Torres X Luis R Conriquez X Anuel AA - Por Si Se Les Olvidaba (REMIX) [Video Oficial],Alex Torres,10,Music,"alex torres, alex torres oficial, alex torres musica, alex torres videos, regional mexicano, sierreño, música mexicana, luis r conriquez, anuel aa, por si se les olvidaba, por si se les olvidaba remix, alex torres por si se les olvidaba remix, alex torres por si se les olvidaba remix video, alex torres por si se les olvidaba remix video oficial, alex torres por si se les olvidana remix oficial, luis r conriquez oficial, luis r conriquez musica, luis r conriquez canciones",179,hd,false,False,500617,37970,1914
VI6XO8EijT4,2025-12-05T20:00:28Z,DIGITAL CIRCUS EP 7 TRAILER!!,GLITCH,1,Film & Animation,"glitch, glitch productions, digital circus, the amazing digital circus, murder drones, Pomni, Uzi, Jax, Ragatha, Kinger, Gangle, Zooble, Caine, Bubble, 3D, Animation, 3D Animation, Indie Animation, Gummigoo",58,hd,true,True,4246050,432127,25504
esPT8WCk_AQ,2025-12-05T17:16:52Z,Me Volví LOCO por un Charizard de 2.900€,Rubius Z,24,Entertainment,"elrubius, rubius, nuevo, 2025, card, tcg, pokemon, charizard, inferno x, hit, full art, ex, new, opening, cartas, phantasmal flames, mega charizard x, mega, carta, cara, caro, meowth, 2026, dinero, cajas, caja, unboxing, sorpresa, mistery, box, meme, memes, gracioso, divertido",1343,hd,false,True,972697,79499,1590
udFsogly8Us,2025-12-04T22:50:53Z,JLEXIS X MICHAEL FLORES X SHADOW BLOW X ALOFOKE MUSIC - ME TOCO VERTE BRILLAR,AlofokeMusicSounds,10,Music,"Bad Bunny, Dembow, Reggaeton, Karol G, Anuel AA, Trap, Rap, Salsa, Merengue, Feid, Santiago Matias, W Sound, Rochy RD, Yailin La Mas Viral, El Alfa, Bulin 47, Romeo Santos, Anthony Santos",184,hd,false,True,2874946,263039,22108
XRRnP91SSrQ,2025-12-05T16:00:21Z,Welcome Home | Poppy Playtime Chapter 5 Cinematic Trailer,Mob Entertainment,20,Gaming,,58,hd,true,True,1787749,161221,11923
_L5NTP2hviE,2025-12-05T22:46:51Z,Usé SUERTE INFINITA en 2 FILAS de COMIDA VS BEBIDA en Steal a Brainrot,SoyNeto,20,Gaming,"roblox, steal a brainrot, brainrot, roba un brainrot, brainrot roblox, brainrot secreto, base brainrot, soyneto, nueva base, flex roblox, 2 FILAS ADMIN, SERVER ADMIN STEAL A BRAINROT, 2 PASARELAS STEAL A BRAINROT, HACKS STEAL A BRAINROT, TRUCOS STEAL A BRAINROT",1953,hd,false,True,577358,6241,610
LEz_eHbD15w,2025-12-02T23:00:31Z,Beéle - si te pillara (LETRA),FlowVerso,10,Music,,184,hd,false,True,130709,109,2
_Z4Rdq-AiAk,2025-12-03T17:01:18Z,"OFICIAL escena Avengers Doomsday Loki VENGADOR y Thor vs Doctor Doom, equipos finales, trailer",Pelicomic,24,Entertainment,,971,hd,false,True,274036,14583,591
PgTkTZvv0mE,2025-12-05T19:33:09Z,Este Freddy Azul Es Mas Rapido Y Bugeado En Hello Neighbor / FNAF Bear 5 Mod,Omenasito,20,Gaming,"fnaf, fnaf in real time, fnaf real time, fnaf in real time gameplay, fnaf en tiempo real, fnaf trailer, fnaf movie, five nights at freddys, five nights at freddys trailer, fnaf plus, fnaf update, fnaf noticias, fnaf 1 fangame, fnaf fangame, mejores fangames, en tiempo real, realista, juego completo, 20/20/20/20, custom night, fnaf pelicula, hello neighbor, fredbear, those nights at freadbear, hello neighbor fredbear, fredbear rapido, mods de fnaf, fredbear mod, FNAF, bear5",1413,hd,false,True,532480,16917,1101
cU2XtlhA6M0,2025-12-05T05:13:30Z,"Xeuz, Kavvo, GIMARIO, DEEIKEL - Si Me Topas Remix (Video Oficial)",Xeuz,10,Music,,285,hd,false,True,9005,1090,98
ODQi85iKTk4,2025-12-02T21:13:10Z,REACCIONANDO A TRAILERS FUNABLES DE DISNEY #2 🤡,Speak,24,Entertainment,"REACCIONANDO A TRAILERS FUNABLES DE DISNEY 🤡, reaccionando, trailers, funables, de, disney, meme, memes, comedia, entretenimiento, johan speak, johan, speak, reaccionando a trailers, trailers funables de disney, trailers de disney con ia, parte 2, segunda parte, #2",761,hd,false,True,536153,25510,816
m9kxfDPadJY,2025-12-05T19:53:11Z,JUGAMOS una TORRE TROLL de NAVIDAD en Roblox con Mandarina,Lyna,20,Gaming,,875,hd,false,True,440509,5800,518
iTTBqm6rVRs,2025-12-02T01:48:24Z,Labios Compartidos - Maná (Letra/Lyrics),Rock Soul,24,Entertainment,"Labios Compartidos, Maná, Labios Compartidos Maná, Labios Compartidos letra, Labios Compartidos lyrics, Maná letra, Maná lyrics, rock latino, rock en español, pop rock, Maná hits, música romántica, canción icónica, Maná oficial, canción para dedicar, música en español, Musicana, rock mexicano, balada rock, música legendaria, rock clásico latino, canción nostálgica, éxitos de Maná, himnos del rock, música para enamorados, baladas poderosas, Maná en vivo",316,hd,false,True,317237,454,5
V_UkrLROjkA,2025-12-02T14:01:47Z,Pokémon Legends: Z-A – Mega Dimension | Mega Lucario Z Reveal Trailer,The Official Pokémon YouTube channel,20,Gaming,"#pokemonlegendsza, #pokemon, #lumiosecity, #MegaLucario",101,hd,false,True,940672,38478,4422
aSpCcVgaULI,2025-12-05T21:01:36Z,Encontramos un COCHE ROBADO Debajo de una Casa en Minecraft,Nacho,20,Gaming,"nacho, dagar, nacho minecraft, dagar y nacho, nacho y dagar, minecraft, minecraft mod, dagar minecraft, coches, coches minecraft, auto, carros minecraft, garaje, garaje minecraft, garaje de coches minecraft, garaje noob, noob vs pro, abandonado, coche abandonado, carro abandonado, super coche, super auto, lambo, lambo minecraft, lamborghini minecraft, coche robado, coche robado minecraft, auto robado robado minecraft, carro robado",1275,hd,false,True,423213,6099,474
85ETxUOFnfM,2025-12-04T18:00:06Z,Danny Ocean - Me Rehúso (Letra),Caribeo,22,People & Blogs,,206,hd,false,True,379996,535,5
Eln66CJHna8,2025-11-29T19:24:34Z,Fortnite Battle Royale Chapter Seven: Pacific Break | Cinematic Trailer,Fortnite,20,Gaming,yt:cc=on,98,hd,false,True,1193811,46616,3507
n09iOx6NwP0,2025-12-06T01:05:28Z,DEBATE DEL MUNDIAL CON LA COBRA Y LATINOS ! DjMaRiiO,DjMaRiiO,20,Gaming,"djmariio, djmario, djmarrio, djmarioo, dj, mario, mariio, fut, fifa, futdraft, draft, plantilla, discard, challenge, pack, opening, handicap, pc, español, trucos, spain, spanish, el camino, MODO HISTORIA, PS5, PS4, ea sports fc, kings league, kings league oficial, ultimate mostoles, fc 25 modo carrera, fifa 25 modo carrera, fc 25 ultimate team, fc 25 gratis, fc 25 nintento switch, fut 25, fifa 25, 25, ea sports fc 25, fifa 25 ps4, fc 25 ps4, fc 25 djmariio, fc 26, ea sports fc 26, la cobra, debates",20286,hd,false,True,347463,4846,35
2yGZPCjtGJ8,2025-12-05T00:00:08Z,Paulo Londra - 1% (feat. Eladio Carrión) [Official Video],Paulo Londra,10,Music,"Paulo Londra, Eladio Carrión, Eladio Carrion, Boxeo, Laveladadelaño, Paulo Londra nuevo video, Eladio Carrión nuevo tema, Paulo Londra videoclip oficial, latin trap, trap latino, urban latin, hip hop latino, rap latino, reggaeton trap, música urbana, Bad Bunny, Anuel AA, Myke Towers, Feid, Duki, Nicki Nicole, Trueno, Bizarrap, YSY A, Neo Pistea, Tiago PZK, Cazzu, Rauw Alejandro, J Balvin, Karol G, Mora, Quevedo, Nicky Jam, Ñengo Flow, Arcángel, Young Miko, milo j",244,hd,false,True,678332,87450,4680
EQ0k9m14R3c,2025-11-26T19:00:15Z,El capítulo perdido: la venganza de Yuki | Tráiler de avance,Fortnite LATAM,20,Gaming,,48,hd,false,True,78778,4651,209
yDuaNgeMs6Y,2025-12-05T01:50:53Z,BAJÉ AL ASCENSOR EN ROBLOX!,FedeGames,20,Gaming,"minecraft, videos de juegos, juegos, gameplays, fede games, fede gameplays, videos de minecraft, vecibanda, fede y sus vecinos, fede vigevani, federico vigevani, vecinos minecraft, videojuegos, bajé al ascensor, roblox",1033,hd,false,True,2971099,97691,6963
-kAFintKKQw,2025-11-29T00:00:02Z,Marc Anthony - Qué Precio Tiene El Cielo (Letra),SabroSón,10,Music,"Marc Anthony, Marc Anthony Qué Precio Tiene El Cielo, Qué Precio Tiene El Cielo, Qué Precio Tiene El Cielo Marc Anthony, Qué Precio Tiene El Cielo Letra, Qué Precio Tiene El Cielo Lyrics, Salsa Romántica, Salsa Marc Anthony, Marc Anthony éxitos, Qué Precio Tiene El Cielo video letra, Qué Precio Tiene El Cielo video lyrics, Canciones Marc Anthony, Salsa para dedicar, Música latina, Salsa clásica, Letra oficial, Latin Music, Marc Anthony hits, Salsa romántica clásica",303,hd,false,True,217556,186,6
iTzCWDQSwvk,2025-11-12T14:30:11Z,Super Mario Galaxy: La Película | Tráiler Oficial,Universal Pictures México,1,Film & Animation,"Universal, Illumination Entertainment, Nintendo, Nintendo Co. Ltd., Mario, Super Mario Bros., Super Mario Movie, Teaser Trailer, Official Title, Luigi, Bowser, Toad, Princess Peach, Mushroom Kingdom, Chris Pratt, Anya Taylor-Joy, Charlie Day, Jack Black, Keegan-Michael Key",145,hd,false,False,5841008,77506,0
BlfNwNc4_4k,2025-12-05T18:57:34Z,👁 MI PRIMERA VEZ JUGANDO EL CAPÍTULO 7 DE FORTNITE (junto a la ratita 🐀),Auron,20,Gaming,"Auron, AuronPlay",2966,hd,false,True,212523,10660,291
2Hjz7-OBMxs,2025-12-03T03:01:21Z,Brayy Music - RIP FRAGÍL 💀 (Final 2) [Video Oficial] @psdmusicoficial @JCRLAFIRMARECORDS,Brayy Music OFICIAL,10,Music,"brayy music, haquil, tiradera haquil, costa rica, la ruta, Haquil, JEYSON HAQUIL, el tico, haquil panama, hablan de lealtad, hablan de lealtad 2, Valentino GRM, haquil el tico, el tiko, dancehall panama, LA RUTA, haquil la ruta, estreno urbano 2025, trap latino, haquil music, haquil musica, haquil tiradera, haquil oficial, hablan de lealtad haquil, haquil ft valentino, música nueva haquil, haquil tip, tip haquil, plena costa rica, tip video oficial",178,hd,false,False,34106,1940,331
9c-DrMe8o5Q,2025-11-12T17:00:17Z,The Devil Wears Prada 2 | Teaser Trailer,20th Century Studios,1,Film & Animation,Trailer,52,hd,false,True,7454065,147678,5067
-2FtOwHotso,2025-12-05T17:30:01Z,CLASE GAMBLER🎰 99 NOCHES CON LOS BROS! #9,ElAbrahaham,20,Gaming,"abrahahamflores, stream, entretenimiento, divertido, risa, gracioso, gamer, videojuegos, elabrahaham, copilacion, videos graciosos, antes vs ahora, mexico vs usa, abrahaham, directos, shorts, tiktoks, streams, twitch, reaccion, reacciones",3731,hd,false,True,560059,15377,1989
Ba7MivcRnO8,2025-12-05T18:00:06Z,Los Parras - Especial - (Video Oficial),Los Parras,10,Music,"Los Parras, alta consigna, los perdidos de sinaloa, los plebes del rancho, corridos, virlan garcia, crecer german, christian nava",179,hd,false,False,222912,32683,2876
2W7z4SB8Vy8,2025-11-09T03:06:13Z,skibidi toilet: emergence | official trailer,DaFuq!?Boom!,24,Entertainment,"skibidi toilet, skibidi toilet emergence, skibidi emergence, skibidi toilet new series, skibidi toilet 80, skibidi explained, skibidi lore, skibidi storyline, skibidi arc, skibidi war, cameraman, tv woman, speakerman, secret agent, watchman of doom, astro toilet, astros vs alliance, alliance vs astros, Dafuqboom, unreal engine animation, skibidi universe, skibidee toilet, Skebedee, toilet skibidi, brainrot, emergence trailer, skibidi trailer, skibidi spoiler, steal a brainrot",51,hd,true,True,6383421,198120,39849
Pe6vB0-8QZ4,2025-12-05T22:55:34Z,SOBREVIVÍMOS 3 dias en el APOCALIPSIS... 💀☢️😰 SILVIOGAMER en MIMESIS con AMIGOS,Silvio Gamer,20,Gaming,"SILVIO, SILVIOGAMER, SILVIO GAMER, MINECRAFT, Silvio, silviogamer, silvio, silvio gamer, minecraft silvio, silvio minecraft, silviogamer minecraft, minecraft silviogamer, silviogamer minecraft pero, minecraft pero, mimesis, sobrevivimos, sobrevivímos, 3 dias, dias, apocalipsis, sobrevivimos 3 dias al apocalipsis, sobrevivimos 3 dias, dia, pancracio, dany, permon, doppleganger, dopplegangers, impostores, impostor",2572,hd,false,True,458372,16792,1631
Y2PR8UYcabs,2025-11-29T20:30:06Z,Romeo Santos - Imitadora (Letra/Lyrics),nostalgia lyrics.,10,Music,,236,hd,false,True,715387,1081,11
cWCoNBY97Eg,2025-12-05T16:15:51Z,CLASH ROYALE NOS REGALA UN HEROE🤑,BENIJU,20,Gaming,"Clash Royale, Clash Royale Español, BENIJU, beniju, subir copas, guia de mazos, mejores mazos, beniyu, bniju, benju, TV ROYALE, TV ROYALE EN ESPAÑOL, JEFA BANDIDA, VERDUGO EVO, NUEVA EVO, NUEVA ACTU, CLASH ACTU, ken, tv royale, tv royale en español, nueva carta, nueva evo, modo ranked",1280,hd,false,True,470883,22754,1396
hBVDSNomKpc,2025-11-06T10:01:14Z,She's Hot (Extended Mix),T.O.K. - Topic,10,Music,"T.O.K, Unknown Language, She's Hot (Extended Mix)",231,hd,false,True,45296,691,0
m2QvSL2olm0,2025-12-06T00:22:22Z,EL MCTRIO VOLVIÓ A REPO… ¡Y TODO SE DESCONTROLÓ! 🔥,ElMariana Gaming,20,Gaming,"el mariana, streams completos el mariana, el mariana momentos divertidos, el mariana y rivers, vlog elmariana, resubidos el mariana, elmariana, mariana, McTrio, Repo, Repo gameplay, ElMariana, Roier, AldoGeo, gameplay español, juego de terror, terror divertido, funny moments, juegos raros, videojuegos 2025, gameplay latino, humor gamer, sustos, fails, juegos cooperativos, juegos multijugador, emoji terror, juego nuevo, lets play español, contenido gaming, repo game español",1032,hd,false,True,205881,12550,286
5TOjrX1EjWg,2025-12-01T17:00:06Z,Grupo Firme - El Beneficio De La Duda (Letra),LowDrow,10,Music,"grupo firme - el beneficio de la duda letra, grupo firme el beneficio de la duda (letra), el beneficio de la duda letra, el beneficio de la duda lyrics, el beneficio de la duda grupo firme letra, grupo firme letra oficial, banda sinaloense 2025, regional mexicano 2025, musica mexicana 2025, corridos romanticos 2025, grupo firme canciones 2025, el beneficio de la duda subtitulos, el beneficio de la duda sub español, el beneficio de la duda video oficial",246,hd,false,True,980090,1658,10
4apcm-wbPyM,2025-12-05T21:15:00Z,ESTE NUEVO FREDBEAR ES MAS RAPIDO QUE EL ORIGINAL EN HELLO NEIGHBOR (FNAF MOD COMPLETO),Chuy Mine,20,Gaming,"chuymine, chuy mine, ESTE NUEVO FREDBEAR ES MAS RAPIDO QUE EL ORIGINAL EN HELLO NEIGHBOR, ESTE NUEVO FREDBEAR ES MAS RAPIDO QUE EL ORIGINAL, ESTE NUEVO FREDBEAR ES MAS RAPIDO, NUEVO FREDBEAR ES MAS RAPIDO QUE EL ORIGINAL, FREDBEAR ES MAS RAPIDO, HELLO NEIGHBOR, FNAF MOD, FNAF, FNAF MOD COMPLETO, NUEVO FREDBEAR, NUEVO FREDBEAR ES MAS RAPIDO, FREDBEAR ES MAS RAPIDO QUE EL ORIGINAL",1360,hd,false,True,352029,3325,283
Q82xDpb0MkI,2025-12-04T23:23:20Z,La Perversa  - Tu La Tiene  (Video Oficial) @mapanegromusiic ,La Perversa,10,Music,"LA PERVERSA, La perversa, la perve, musica urbana dj adoni, El Alfa El jefe, La Materialista, La Insuperable, amanece bailando, La Perversa, NTG - Si Tu Quieres, la perversa si tu quieres, la perversa, la perversa entrevista, el alfa el jefe, la insuperable, la perversa y yomel el meloso, la perversa dembow, musica la perversa, Ellos Vienen Ellos Van la perversa, Amor Realengo le perversa, Hoy Si la perversa, flow sexy la perversa, la perversa jey one, jey one",123,hd,false,True,650102,56054,19057
eaHhnUNkVe8,2025-12-04T20:59:47Z,Este Regalo Navideño ESCONDE UN SECRETO!!,JuegaGerman,20,Gaming,"juegagerman, juega, german, holasoygerman, hola soy german, juega german, horror, terror, miedo",2879,hd,false,True,608030,29696,1304
Ut6O9-jj9as,2025-11-30T16:00:06Z,Reik - Ya Me Enteré (Letra),Scribella,22,People & Blogs,,211,hd,false,True,590399,936,5
APJ-lT0sBhg,2025-12-05T14:56:45Z,GTA Online: A Safehouse in the Hills Coming December 10,Rockstar Games,20,Gaming,"GTA Online, GTAV, GTA5 Online, GTA 5, GTA Online Update, A Safehouse in the Hills, PS5, PS4, PlayStation 5, PlayStation 4, Xbox Series X|S, Xbox One, PC, Mansions, Michael De Santa",61,hd,true,True,1219873,104146,9073
NVgQufr_BXw,2025-11-28T18:38:21Z,Todo el día,4bes - Topic,10,Music,"4bes, PWater Sounds, Jeybil, Todo el día",112,hd,false,True,12807,470,22
q_JuxAy4v8g,2025-12-05T16:57:08Z,DESMENTÍ 77 MITOS DEL CAPITULO 7 DE FORTNITE,Hiper,20,Gaming,"fortnite, fortnite og, fornait, fornite, epic, epic games, hyper, hiper, skin, top 10, skins, estereotipos, esteriotipos, eseriotipos, mitos, mito, problemas, isla, resumen, mítica, mapa, creativo, minijuegos, meme, evento, event, marvel, retos, logros, mitos hiper, simpsons, homero, homer, capitulo 7, zero hour, kill, bill, capitulo 7 hiper, pacific break, regreso al futuro, back to the future, volver al future, mcfly, doc, brown, los siete, the seven, lore, TLR, lisa, 7.1, godzilla, kong, the rock, la roca",1563,hd,false,True,340960,8870,178
0K6zoNeSENI,2025-12-02T01:00:00Z,San Jose,BARBEL - Topic,10,Music,"Barbel, San Jose",236,hd,false,True,74796,1820,18
q5o1z2dlq8E,2025-12-05T19:15:06Z,LOS VIDEOS MAS RAROS de 99 NOCHES EN EL BOSQUE 🤨😳 (Parte 3),ChuuyMine,20,Gaming,"LOS VIDEOS MAS RAROS de 99 NOCHES EN EL BOSQUE 🤨😳 (Parte 3), LOS VIDEOS MAS RAROS de 99 NOCHES EN EL BOSQUE, VIDEOS MAS RAROS de 99 NOCHES EN EL BOSQUE, 99 NOCHES EN EL BOSQUE, LOS VIDEOS MAS RAROS de 99 NOCHES, 99 NOCHES, chuuymine, 99 noches chuuymine, chuuymine 99 noches, 99 noches en el bosque chuuymine, chuuymine 99 noches en el bosque, videos raros chuuymine, chuuymine videos raros",1859,hd,false,True,235325,2415,248
8Yiyrm6rM58,2025-12-01T16:00:06Z,Maluma - Sobrio (Letra),Urban Heartbeat,22,People & Blogs,"Maluma, Sobrio, Letra, sobrio, sobrio letra maluma, maluma sobrio letra",199,hd,false,True,835926,809,10
UskCmjT1PfQ,2025-12-05T22:18:47Z,Me Convertí en el 67 KID para AYUDAR a Mi AMIGA en Minecraft...,DanoMC,20,Gaming,"Me Convertí en el 67 KID para AYUDAR a Mi AMIGA en Minecraft, danomc, dano, mc, niki, me converti para ayudar a mi amiga, ayudar a mi amiga en minecraft, me converti en 67, me converti en 67 para ayudar a mi amiga, danomc 67, danomc 67 kid, 67, 67 kid, 67 brainrot, 67 meme, minecraft, keciyo, superkeciyo, danomc y niki, danomc ayude a mi amigo, danomc ayuda a niki, danomc amiga, danomc chica, dano y niki, danomc trolea a arsel, danomc minecraft, minecraft mod, minecraft pero",1567,hd,false,True,257234,3083,226
qfa3FSf0UQE,2025-12-01T02:17:32Z,HAQUIL - EL NÚMERO #1  ( VISUALIZER ) ,Haquil,10,Music,"haquil, haquil tiradera, haquil el numero 1, el numero 1 haquil, tiradera haquil, haquil vs brayy, haquil vs nerry sin money, tiradera para brayy, tiradera para nerry sin money, brayy diss, nerry sin money diss, beef musical, tiradera 2025, visualizer haquil, musica urbana, diss track, rap latino, pelea musical, letra haquil, estilo calle, sonido callejero, haquil costa rica, trap tico, rap costa rica, trap costa rica, musica urbana costa rica, rap centroamericano",239,hd,false,True,61840,2375,388
g2yAMGtUavE,2025-12-04T19:21:21Z,Dagar NO PUEDE DESPERTARSE en Minecraft!,Dagar,20,Gaming,"Minecraft, minecraft mod, dagar y nacho, nacho y dagar, amigos minecraft, dagar minecraft, minecraft dagar",1449,hd,false,True,829275,10225,623
gUvH8kalgbI,2025-11-26T21:00:06Z,La 5a Estación - El Sol No Regresa (Letra),Romantic FM,22,People & Blogs,,229,hd,false,True,421027,585,7
zlLVd9jTKUo,2025-12-06T01:34:11Z,EL INEVITABLE ALGORITMON | EXPERTO INFINITO (NO SKIP) - ZetaSSJ,ZetaSSJ,20,Gaming,"zeta, zetassj, francisco, nintendo, mario, maker, smash, youtuber, conce, chile, español, imposible, 99%, dificil, super expert, experto, epic, epico, win, lose, perder, ganar, triunfar, vencer, niveles, nivel, level, record, records, fail, fails, lol, princesa, castillo, 0%, 100%, escenas, memes, meme, dbz, dragon ball, bob esponja, simpsons, homero, musica, remix, speedrun, japones, japo, pillo, troll, atajos, secretos, mario 64, escaleras, stairs, edicion, super, expert, feo, kirby, fallar, run, partida, inicio, speed, TROLES, trolear, SUS",2004,hd,false,True,101031,13254,884
