video_id,published_at,title,channel_title,category_id,category_name,tags,duration,definition,caption_available,licensed_content,views,likes,comments
udFsogly8Us,2025-12-04T22:50:53Z,JLEXIS X MICHAEL FLORES X SHADOW BLOW X ALOFOKE MUSIC - ME TOCO VERTE BRILLAR,AlofokeMusicSounds,10,Music,"Bad Bunny, Dembow, Reggaeton, Karol G, Anuel AA, Trap, Rap, Salsa, Merengue, Feid, Santiago Matias, W Sound, Rochy RD, Yailin La Mas Viral, El Alfa, Bulin 47, Romeo Santos, Anthony Santos",184,hd,false,True,2874946,263039,22108
VI6XO8EijT4,2025-12-05T20:00:28Z,DIGITAL CIRCUS EP 7 TRAILER!!,GLITCH,1,Film & Animation,"glitch, glitch productions, digital circus, the amazing digital circus, murder drones, Pomni, Uzi, Jax, Ragatha, Kinger, Gangle, Zooble, Caine, Bubble, 3D, Animation, 3D Animation, Indie Animation, Gummigoo",58,hd,true,True,4246050,432127,25504
_L5NTP2hviE,2025-12-05T22:46:51Z,Usé SUERTE INFINITA en 2 FILAS de COMIDA VS BEBIDA en Steal a Brainrot,SoyNeto,20,Gaming,"roblox, steal a brainrot, brainrot, roba un brainrot, brainrot roblox, brainrot secreto, base brainrot, soyneto, nueva base, flex roblox, 2 FILAS ADMIN, SERVER ADMIN STEAL A BRAINROT, 2 PASARELAS STEAL A BRAINROT, HACKS STEAL A BRAINROT, TRUCOS STEAL A BRAINROT",1953,hd,false,True,577358,6241,610
JXm4DbRyKhI,2025-12-04T18:48:39Z,Daniela,Rodolfo Aicardi - Topic,10,Music,"Rodolfo Aicardi, Los Hispanos, Manuel Arce Zurita, 14 Cañonazos Bailables, Vol. 19, Daniela",199,hd,false,True,3805,52,0
XRRnP91SSrQ,2025-12-05T16:00:21Z,Welcome Home | Poppy Playtime Chapter 5 Cinematic Trailer,Mob Entertainment,20,Gaming,,58,hd,true,True,1787749,161221,11923
esPT8WCk_AQ,2025-12-05T17:16:52Z,Me Volví LOCO por un Charizard de 2.900€,Rubius Z,24,Entertainment,"elrubius, rubius, nuevo, 2025, card, tcg, pokemon, charizard, inferno x, hit, full art, ex, new, opening, cartas, phantasmal flames, mega charizard x, mega, carta, cara, caro, meowth, 2026, dinero, cajas, caja, unboxing, sorpresa, mistery, box, meme, memes, gracioso, divertido",1343,hd,false,True,972697,79499,1590
WyX8FPQvzmU,2025-12-02T10:30:21Z,Grupo Niche - Gotas de Lluvia (Letra/Lyrics),LatinVerse,22,People & Blogs,"latin verse, latinverse lyrics, latinverse, latin verse lyrics, grupo niche gotas de lluvia, gotas de lluvia, gotas de lluvia grupo niche, grupo niche gotas de lluvia letra, gotas de lluvia letra, gotas de lluvia grupo niche letra, grupo niche gotas de lluvia lyrics, gotas de lluvia lyrics, gotas de lluvia grupo niche lyrics, tiktok, tiktok song, tiktok remix, lyrics on screen",355,hd,false,True,60483,90,0
t7q8pI_B-TQ,2025-12-05T21:43:57Z,ANÁLISIS COMPLETO del TRAILER del EPISODIO 7 - The Amazing Digital Circus,Sinergia Experimental,1,Film & Animation,"the amazing digital circus, el asombroso circo digital, circo digital, sirco, circo, digital, el increible circo digital, circo digital español, circo digital en español, circo digital roblox, circo digital intro, Amazing Digital Circus resumen, Pomni, Que es el asombroso circo digital, Que es the amazing digital circus, Asombroso Circo Digital Teorias, Circo Digital, Digital Circus, Piloto Digital Circus, The Amazing Digital Circus piloto, pomni x jax, ver el circo digital, caine",482,hd,false,True,80343,3577,277
aSpCcVgaULI,2025-12-05T21:01:36Z,Encontramos un COCHE ROBADO Debajo de una Casa en Minecraft,Nacho,20,Gaming,"nacho, dagar, nacho minecraft, dagar y nacho, nacho y dagar, minecraft, minecraft mod, dagar minecraft, coches, coches minecraft, auto, carros minecraft, garaje, garaje minecraft, garaje de coches minecraft, garaje noob, noob vs pro, abandonado, coche abandonado, carro abandonado, super coche, super auto, lambo, lambo minecraft, lamborghini minecraft, coche robado, coche robado minecraft, auto robado robado minecraft, carro robado",1275,hd,false,True,423213,6099,474
85ETxUOFnfM,2025-12-04T18:00:06Z,Danny Ocean - Me Rehúso (Letra),Caribeo,22,People & Blogs,,206,hd,false,True,379996,535,5
pROx0N1gHwE,2025-12-04T02:31:23Z,La Reina del Flow 3 | Tráiler Oficial - Muy Pronto,Caracol Televisión,24,Entertainment,"Caracol Tv, Caracol Televisión, Caracol en vivo, Programas Caracol, caracol televisión, caracol tv, la reina del flow 3 trailer, la reina del flow 3 trailer oficial, LRDF 3 trailer, la reina de l flow 3 avance, la reina del flow 3 nueva temporada, la reina del flow nueva temporada, la reina del flow 3 temporada",201,hd,false,True,264495,9404,450
XAH6nYUhFSI,2025-12-05T20:30:06Z,El Mejor Juego de Slenderman de La Historia 😨 | Slender The Arrival Historia Completa,Peli,20,Gaming,"peli juegos de terror, pelicanger terror, peli terror, pelicanger slenderman the arrivals, top juegos de terror, pelicanger jugando slenderman, peli slenderman, pelicanger slenderman, juego de terror, pelicanger, peli terror juegos, pelicanger juegos, pelicanger jugando, peli juegos, slenderman, slenderman the arrivals, peli jugando juegos de terror, slender the arrival, juegos de slenderman, slender, pelicanger juegos de terror, peli juegos de miedo, pelicanger terror juegos",6070,hd,false,True,68346,4288,253
AJNwATS0H20,2025-12-05T00:00:07Z,"Justin Quiles, Lenny Tavárez, Blessd - LAS NEAS (Video Oficial)",Justin Quiles,10,Music,"Justin Quiles, J Quiles, lenny tavarez, blessd, las neas, las neas justin quiles, las neas blessd, las neas jquiles, las neas lenny tavarez, lo nuevo de jquiles, lo nuevo de lenny tavarez, lo nuevo de blessd, las neas justin quiles lenny tavarez blessd, ovy on the drums, lo nuevo de ovy on the drums",205,hd,false,True,231457,14178,434
OUjALZAVAz0,2025-12-06T00:43:26Z,THE AMAZING DIGITAL CIRCUS  EPISODIO 7 | TRAILER,FanGirl,1,Film & Animation,"Miraculous, Ladybug",500,hd,false,True,37042,1601,176
m9kxfDPadJY,2025-12-05T19:53:11Z,JUGAMOS una TORRE TROLL de NAVIDAD en Roblox con Mandarina,Lyna,20,Gaming,,875,hd,false,True,440509,5800,518
aRcTE1aH0_A,2025-12-04T15:09:52Z,CÓMO TE QUIERO - Elder Dayán Díaz y Lucas Dangond (Video Oficial),ELDER DAYÁN DÍAZ,10,Music,"DIOMEDES DIAZ, DIOMEDES, EL CACIQUE, ELDER DAYAN, EL CANTOR, ELDER DIAZ, LUCAS DANGOND, SILVESTRE DANGOND, MARTIN ELIAS, DIAZ, MONO ZABALETA, LO NUEVO DEL MONO, LA BOMBA, LE REINA, TU ERES LA REINA, EXITOSE, EXITOS DEL CACIQUE, EXITOS DE DIOMEDES, EXITOS PARA BEBER, PETER MANJARRES, OSCAR GAMARRA, ANA DEL CASTILLO, CHURO DIAZ, MANDA CACHAZA, EXITOS DE MARTIN ELIAS, PARA DEDICAR, DINASTIA, PARRANDA, ELDER EN PARRANDA, AMANTES, DIEGO DAZA, LO NUEVO DE DIEGO DAZA, CARLOS RUEDA",279,hd,false,True,85403,3064,205
avtunpP2a9M,2025-12-04T00:00:01Z,El Gran Diluvio | Tráiler oficial | Netflix,Netflix Latinoamérica,24,Entertainment,"Corea del Sur, El Gran Diluvio, Kim Da-mi, Netflix, Park Hae-soo, SF, The Great Flood, acción, blockbuster, catástrofe, ciencia ficción, desastre, diciembre, director Kim Byung-woo, estreno, nuevo lanzamiento, películas coreanas, sci-fi, taquillazo, una película de Netflix",124,hd,false,False,449070,4637,160
PgTkTZvv0mE,2025-12-05T19:33:09Z,Este Freddy Azul Es Mas Rapido Y Bugeado En Hello Neighbor / FNAF Bear 5 Mod,Omenasito,20,Gaming,"fnaf, fnaf in real time, fnaf real time, fnaf in real time gameplay, fnaf en tiempo real, fnaf trailer, fnaf movie, five nights at freddys, five nights at freddys trailer, fnaf plus, fnaf update, fnaf noticias, fnaf 1 fangame, fnaf fangame, mejores fangames, en tiempo real, realista, juego completo, 20/20/20/20, custom night, fnaf pelicula, hello neighbor, fredbear, those nights at freadbear, hello neighbor fredbear, fredbear rapido, mods de fnaf, fredbear mod, FNAF, bear5",1413,hd,false,True,532480,16916,1101
dDwoyrVcbEo,2025-12-05T06:00:06Z,Alex Torres X Luis R Conriquez X Anuel AA - Por Si Se Les Olvidaba (REMIX) [Video Oficial],Alex Torres,10,Music,"alex torres, alex torres oficial, alex torres musica, alex torres videos, regional mexicano, sierreño, música mexicana, luis r conriquez, anuel aa, por si se les olvidaba, por si se les olvidaba remix, alex torres por si se les olvidaba remix, alex torres por si se les olvidaba remix video, alex torres por si se les olvidaba remix video oficial, alex torres por si se les olvidana remix oficial, luis r conriquez oficial, luis r conriquez musica, luis r conriquez canciones",179,hd,false,False,500617,37970,1914
chB1gtM5fPw,2025-12-05T16:01:13Z,POPPY SE ENCUENTRA CON UN NUEVO ENEMIGO EN POPPY PLAYTIME CHAPTER 5 (Trailer Oficial),iTownGamePlay *Terror&Diversión*,20,Gaming,"towngameplay, itowngameplay, town, itown, terror, miedo, gritos, sustos, entretenimiento, diversión, videojuegos, juegos, español, canciones, fnaf, roblox, creepypastas, música, game, games, horror, fun, happy, android, móvil, celular, IOS",867,hd,false,True,32344,2767,183
4apcm-wbPyM,2025-12-05T21:15:00Z,ESTE NUEVO FREDBEAR ES MAS RAPIDO QUE EL ORIGINAL EN HELLO NEIGHBOR (FNAF MOD COMPLETO),Chuy Mine,20,Gaming,"chuymine, chuy mine, ESTE NUEVO FREDBEAR ES MAS RAPIDO QUE EL ORIGINAL EN HELLO NEIGHBOR, ESTE NUEVO FREDBEAR ES MAS RAPIDO QUE EL ORIGINAL, ESTE NUEVO FREDBEAR ES MAS RAPIDO, NUEVO FREDBEAR ES MAS RAPIDO QUE EL ORIGINAL, FREDBEAR ES MAS RAPIDO, HELLO NEIGHBOR, FNAF MOD, FNAF, FNAF MOD COMPLETO, NUEVO FREDBEAR, NUEVO FREDBEAR ES MAS RAPIDO, FREDBEAR ES MAS RAPIDO QUE EL ORIGINAL",1360,hd,false,True,352029,3325,283
Lft96pZFjQQ,2025-12-05T21:00:33Z,Alci Acosta - No Renunciaré (Letra/Lyrics),ROSES,10,Music,"latin music, lyrics, letra, roses, music, rosas, musica, letras, Alci Acosta No Renunciaré, No Renunciaré letra, No Renunciaré lyrics, Alci Acosta letra, bolero romántico, música para dedicar, música romántica, música de despecho, canción con letra, video lyric, letra oficial, bolero clásico",189,hd,false,True,15459,109,2
LW4HgHdKmnM,2025-12-05T16:02:00Z,El tráiler de Poppy 5 CONFIRMA la teoría que todos ignoraron,Sr LOBO,20,Gaming,"sr lobo, srlobo, Poppy Playtime, Poppy Playtime 5, Poppy Playtime capítulo 5, tráiler Poppy Playtime 5, análisis tráiler Poppy Playtime 5, análisis Poppy Playtime 5, explicación tráiler Poppy 5, Poppy Playtime teoría, Experimento 1006, análisis 1006, Lily Loverbraids, nuevo personaje Poppy Playtime, monstruo cresta Poppy Playtime, Outimals, Poppy Playtime 5 secretos, secretos trailer Poppy Playtime 5, easter eggs Poppy Playtime 5, chapter 5 trailer analysis",543,hd,false,True,58057,1977,189
Pe6vB0-8QZ4,2025-12-05T22:55:34Z,SOBREVIVÍMOS 3 dias en el APOCALIPSIS... 💀☢️😰 SILVIOGAMER en MIMESIS con AMIGOS,Silvio Gamer,20,Gaming,"SILVIO, SILVIOGAMER, SILVIO GAMER, MINECRAFT, Silvio, silviogamer, silvio, silvio gamer, minecraft silvio, silvio minecraft, silviogamer minecraft, minecraft silviogamer, silviogamer minecraft pero, minecraft pero, mimesis, sobrevivimos, sobrevivímos, 3 dias, dias, apocalipsis, sobrevivimos 3 dias al apocalipsis, sobrevivimos 3 dias, dia, pancracio, dany, permon, doppleganger, dopplegangers, impostores, impostor",2572,hd,false,True,458372,16792,1631
yZgCjPUOD58,2025-12-03T20:06:45Z,ES UN SECRETO - Plan B,Boyz Club,10,Music,"Plan B, Chencho Corleone, Es un secreto, Plab B es un secreto, Es un secreto Plan B, Es un secreto Letra, Letra Es un Secreto, es un serecreto que tu mirada y la mía, Sin que me hables a entenderte, Yo sé lo que traes en tu mente Plan B, Plab B Yo sé lo que trae en tu mente",215,hd,false,True,380189,692,9
fxZAU2fHwZ8,2025-12-04T21:58:19Z,El Caballero de los Siete Reinos | Tráiler Oficial | HBO Max,HBO Max Latinoamérica,22,People & Blogs,"HBOMAX, hbo max, max, delcineatucasa, hbo, hbo originals, hbo max originals, particual crowd, peliculas, series, movie, serie, trailer, teaser, episodios",141,hd,false,False,58173,2836,202
q5o1z2dlq8E,2025-12-05T19:15:06Z,LOS VIDEOS MAS RAROS de 99 NOCHES EN EL BOSQUE 🤨😳 (Parte 3),ChuuyMine,20,Gaming,"LOS VIDEOS MAS RAROS de 99 NOCHES EN EL BOSQUE 🤨😳 (Parte 3), LOS VIDEOS MAS RAROS de 99 NOCHES EN EL BOSQUE, VIDEOS MAS RAROS de 99 NOCHES EN EL BOSQUE, 99 NOCHES EN EL BOSQUE, LOS VIDEOS MAS RAROS de 99 NOCHES, 99 NOCHES, chuuymine, 99 noches chuuymine, chuuymine 99 noches, 99 noches en el bosque chuuymine, chuuymine 99 noches en el bosque, videos raros chuuymine, chuuymine videos raros",1859,hd,false,True,235325,2415,248
SixTbTc6YCg,2025-12-05T17:00:06Z,"Ice Spice, Tokischa - Thootie",IceSpiceVEVO,10,Music,"Ice Spice, Tokischa, 10K Projects/Capitol Records, Hip Hop",153,hd,true,True,516179,48819,2663
oEhIj0ODFPU,2025-12-03T20:15:06Z,Magma Reacciona los TRAILERS  MÁS FUNABLES de DISNEY PIXAR 💀🤣,Magma Plus,22,People & Blogs,"themagmaboi, themagmarec, magmaboi, magma reacciona, magma animacion, magma mp4, magmita, juego completo, magmaboi juega, magma juega, magmaboi minecraft, themagmaboi minecraft, magmaboi tiktok, magmaboi roblox, trailers de disney, trailers de disney ia, trailers de disney funables, trailers de pixar funables, sora ia, ia disney, magma ia, magmaboi ia, magma trailers de películas, magma trailers de ia, magma reacciona a ia, videos de ia, disney ia, pixar ia",2305,hd,false,True,296864,14034,556
yDuaNgeMs6Y,2025-12-05T01:50:53Z,BAJÉ AL ASCENSOR EN ROBLOX!,FedeGames,20,Gaming,"minecraft, videos de juegos, juegos, gameplays, fede games, fede gameplays, videos de minecraft, vecibanda, fede y sus vecinos, fede vigevani, federico vigevani, vecinos minecraft, videojuegos, bajé al ascensor, roblox",1033,hd,false,True,2971099,97691,6963
iTTBqm6rVRs,2025-12-02T01:48:24Z,Labios Compartidos - Maná (Letra/Lyrics),Rock Soul,24,Entertainment,"Labios Compartidos, Maná, Labios Compartidos Maná, Labios Compartidos letra, Labios Compartidos lyrics, Maná letra, Maná lyrics, rock latino, rock en español, pop rock, Maná hits, música romántica, canción icónica, Maná oficial, canción para dedicar, música en español, Musicana, rock mexicano, balada rock, música legendaria, rock clásico latino, canción nostálgica, éxitos de Maná, himnos del rock, música para enamorados, baladas poderosas, Maná en vivo",316,hd,false,True,317237,454,5
IaEtA56pd_w,2025-12-05T20:48:18Z,Iron Lung: Final Trailer,Markiplier,20,Gaming,"markiplier, iron lung, iron lung movie, official trailer, movie trailer, iron lung trailer 3, final trailer, iron lung release date, iron lung markiplier, Caroline Kaplan, troy baker",105,hd,false,False,2084361,325017,16819
UskCmjT1PfQ,2025-12-05T22:18:47Z,Me Convertí en el 67 KID para AYUDAR a Mi AMIGA en Minecraft...,DanoMC,20,Gaming,"Me Convertí en el 67 KID para AYUDAR a Mi AMIGA en Minecraft, danomc, dano, mc, niki, me converti para ayudar a mi amiga, ayudar a mi amiga en minecraft, me converti en 67, me converti en 67 para ayudar a mi amiga, danomc 67, danomc 67 kid, 67, 67 kid, 67 brainrot, 67 meme, minecraft, keciyo, superkeciyo, danomc y niki, danomc ayude a mi amigo, danomc ayuda a niki, danomc amiga, danomc chica, dano y niki, danomc trolea a arsel, danomc minecraft, minecraft mod, minecraft pero",1567,hd,false,True,257234,3083,226
cPofJQXeXxc,2025-11-27T06:02:31Z,VOLVER A VERNOS,Pirlo - Topic,10,Music,"Pirlo, JC Reyes, Big Papa313, VOLVER A VERNOS",160,hd,false,True,19354,1330,86
-2FtOwHotso,2025-12-05T17:30:01Z,CLASE GAMBLER🎰 99 NOCHES CON LOS BROS! #9,ElAbrahaham,20,Gaming,"abrahahamflores, stream, entretenimiento, divertido, risa, gracioso, gamer, videojuegos, elabrahaham, copilacion, videos graciosos, antes vs ahora, mexico vs usa, abrahaham, directos, shorts, tiktoks, streams, twitch, reaccion, reacciones",3731,hd,false,True,560059,15377,1989
75XXTPDJYew,2025-12-05T05:04:01Z,Te Culié,Ozuna - Topic,10,Music,"Ozuna, オズナ, Beéle, Stendhal, Te Culié",119,hd,false,True,49187,2087,59
LNAAU6ptIX4,2025-12-05T23:09:16Z,LE COMPARTO MI ROPA A MI FUTURA DUITA Y ASI LOGRAMOS UN BOOYAH INCREÍBLE en FREE FIRE !! 😱,SOYTINCA,20,Gaming,,768,hd,false,True,248660,11444,544
lTCzOeJi1Io,2025-12-05T00:00:06Z,Tamarindo Seco  - Natalia Curvelo & Rolando Ochoa (Video Oficial),Natalia Curvelo,10,Music,"Natalia Curvelo, Hoy, Natalia, La Curvelo, vallenato Femenino, Colombia, Vallenato Mix, musica, Dime La Verdad, Miguel Morales, Que yo no puedo vivir sin ti, Patricia Theran, Sirena Encantada, Que Me Puedas Amar, Mi Diosa Humana, La Verdad De Tu Amor, No Te Detengas, No Puedo Vivir Sin T, Acompáñame, Ayúdame A Olvidarla, Otra Primavera, Jamás Me Cansaré De Ti, Sin Ti No Hay Vida, Luis Mateus, Corazoncito Negro, Por Tu Primer Beso, La Dueña De Mi Suerte, Lo Tienes Todo",218,hd,false,True,33444,1473,93
sO8Zia5j0Mw,2025-12-05T21:45:04Z,Usando el NUEVO Glitch de la ALFOMBRA VOLADORA Para ROBAR en Steal a Brainrot!,TurboBlox,20,Gaming,"turbo, sara, amanda, maya, eva, turbo y amanda, turbo y sara, turbo y maya, Usando el NUEVO Glitch de la ALFOMBRA VOLADORA Para ROBAR en Steal a Brainrot!",845,hd,false,True,176125,2433,154
SGOV9YncfHA,2025-12-05T13:00:06Z,"La Cachaquita – Iván Villazón, Jerónimo Villazón (Audio Oficial)",Iván Villazón,10,Music,"Iván Villazón, Me Quedo Con Tus Besos Iván Villazón, El Payaso De La Esquina Iván Villazón, Perdoname Iván Villazón, Solo Me Importas Tu Iván Villazón, ivan villazon, iván villazón, villazon, me quedo con tus besos ivan villazon, el payaso de la esquina ivan villazon, comprendeme ivan villazon, tu olvido ivan villazon, lleno de sentimiento ivan villazon, ivan villazon exitos, abelardo de la espriella, de la espriella, La Cachaquita – Iván Villazón, Jerónimo Villazón",259,hd,false,True,12670,563,56
g3XjJhIW-FA,2025-12-05T21:58:46Z,ACENIX vs SUPER AUTOS 😱😂 COCHES vs CORREDORES en GTA 5,Acenix,20,Gaming,"acenix, gta 5, gta",1528,hd,false,True,166568,4538,338
qtWHYSU-WDE,2025-12-05T02:00:06Z,"Leroy La L - PICHO PACHO (video oficial) DIR. John ""Bugz"" Serna",Leroy La L,10,Music,"trap, trap szn, tura, Leroy La L, Picho Pacho, música urbana, trap colombiano, street music, John Bugz Serna, flow calle, trap latino, trap 2025, video oficial, ritmo oscuro, barras callejeras, sonido callejero, movimiento trap, escena urbana, visual oficial, estilo crudo, callejón, trap underground, cultura calle, sonido pesado, buenaventrua, buenaventura",161,hd,false,True,25500,3066,183
4L_XEZFj1nM,2025-12-05T16:25:14Z,CHICAS vs CHICOS en Steal a Brainrot!,Dagar Roblox,20,Gaming,"roblox, roblox dagar, roblox nacho, nacho y dagar, dagar y nacho",905,hd,false,True,248369,2860,230
w6vYacMWX_o,2025-12-06T00:00:06Z,Amor o Costumbre - CARLOS SARMIENTO (Video Oficial),Carlos Sarmiento,10,Music,"carlos sarmiento, amor a costumbre, mapires music, walter silva el puñal, yenifer mora no te lo creo, milena benites popurri, emily galaviz, musica llanera, colombia, venezuela, jorge guerrero exitos",236,hd,false,True,4445,374,33
n09iOx6NwP0,2025-12-06T01:05:28Z,DEBATE DEL MUNDIAL CON LA COBRA Y LATINOS ! DjMaRiiO,DjMaRiiO,20,Gaming,"djmariio, djmario, djmarrio, djmarioo, dj, mario, mariio, fut, fifa, futdraft, draft, plantilla, discard, challenge, pack, opening, handicap, pc, español, trucos, spain, spanish, el camino, MODO HISTORIA, PS5, PS4, ea sports fc, kings league, kings league oficial, ultimate mostoles, fc 25 modo carrera, fifa 25 modo carrera, fc 25 ultimate team, fc 25 gratis, fc 25 nintento switch, fut 25, fifa 25, 25, ea sports fc 25, fifa 25 ps4, fc 25 ps4, fc 25 djmariio, fc 26, ea sports fc 26, la cobra, debates",20286,hd,false,True,347463,4846,35
2yGZPCjtGJ8,2025-12-05T00:00:08Z,Paulo Londra - 1% (feat. Eladio Carrión) [Official Video],Paulo Londra,10,Music,"Paulo Londra, Eladio Carrión, Eladio Carrion, Boxeo, Laveladadelaño, Paulo Londra nuevo video, Eladio Carrión nuevo tema, Paulo Londra videoclip oficial, latin trap, trap latino, urban latin, hip hop latino, rap latino, reggaeton trap, música urbana, Bad Bunny, Anuel AA, Myke Towers, Feid, Duki, Nicki Nicole, Trueno, Bizarrap, YSY A, Neo Pistea, Tiago PZK, Cazzu, Rauw Alejandro, J Balvin, Karol G, Mora, Quevedo, Nicky Jam, Ñengo Flow, Arcángel, Young Miko, milo j",244,hd,false,True,678332,87450,4680
Xu_U6fd7zvQ,2025-12-05T12:01:14Z,VIDA de IRON GOLEM no Minecraft!,Cadres,20,Gaming,,1257,hd,false,True,1598952,11655,118
LEz_eHbD15w,2025-12-02T23:00:31Z,Beéle - si te pillara (LETRA),FlowVerso,10,Music,,184,hd,false,True,130709,109,2
68bveB0jNcw,2025-12-05T19:00:08Z,Jugando como AGENTE SECRETO en GTA 5,Vista Gamer,20,Gaming,"gta 5, gta v, grand theft auto 5, grand theft auto v, vista gamer, Jugando como AGENTE SECRETO en GTA 5, Uniéndome a las FUERZAS ESPECIALES en GTA 5, POLICÍA de NIVEL 1 a 100 en GTA 5 (Pelicula), Jefe del SWAT en GTA 5, ME TRANSFORMO en el SWAT Mas FUERTE de GTA 5, POLICÍA de $1 a $10.000.000 en GTA 5, MILITAR de $1 a $10.000.000 en GTA 5, ME TRANSFORMO en el POLICÍA Mas FUERTE de GTA 5, ME TRANSFORMO en el MILITAR Mas FUERTE de GTA 5, jugando como policía en gta 5",1250,hd,false,True,291666,4726,209
jps8cu_z2x4,2025-12-02T18:11:00Z,Marc Anthony - Vivir Mi Vida (Letra),Kintsugi Sonar,10,Music,"Marc Anthony Vivir Mi Vida Letra, Marc Anthony Vivir Mi Vida, Marc Anthony Vivir Mi Vida Lyrics, Vivir Mi Vida, Vivir mi vida letra, letra vivir mi vida, vivir mi vida lyrics, lyrics vivir mi vida, letra marc anthony vivir mi vida, lyrics marc anthony vivir mi vida, vivir mi vida letra marc anthony, marc anthony letra, letra marc anthony, marc anthony letra video, latin letra, latin lyrics, latin songs, musica latina, latin music, latin hits, viral, viral hits, viral songs",253,hd,false,True,21142,45,1
