video_id,published_at,title,channel_title,category_id,category_name,tags,duration,definition,caption_available,licensed_content,views,likes,comments
Ba7MivcRnO8,2025-12-05T18:00:06Z,Los Parras - Especial - (Video Oficial),Los Parras,10,Music,"Los Parras, alta consigna, los perdidos de sinaloa, los plebes del rancho, corridos, virlan garcia, crecer german, christian nava",179,hd,false,False,222912,32683,2876
VI6XO8EijT4,2025-12-05T20:00:28Z,DIGITAL CIRCUS EP 7 TRAILER!!,GLITCH,1,Film & Animation,"glitch, glitch productions, digital circus, the amazing digital circus, murder drones, Pomni, Uzi, Jax, Ragatha, Kinger, Gangle, Zooble, Caine, Bubble, 3D, Animation, 3D Animation, Indie Animation, Gummigoo",58,hd,true,True,4246050,432132,25505
_L5NTP2hviE,2025-12-05T22:46:51Z,Usé SUERTE INFINITA en 2 FILAS de COMIDA VS BEBIDA en Steal a Brainrot,SoyNeto,20,Gaming,"roblox, steal a brainrot, brainrot, roba un brainrot, brainrot roblox, brainrot secreto, base brainrot, soyneto, nueva base, flex roblox, 2 FILAS ADMIN, SERVER ADMIN STEAL A BRAINROT, 2 PASARELAS STEAL A BRAINROT, HACKS STEAL A BRAINROT, TRUCOS STEAL A BRAINROT",1953,hd,false,True,577358,6241,610
_Zp5vwF4mfY,2025-12-05T22:44:46Z,"El ALFA ""El Jefe"" x El Bogueto x BlueMoney x BryantLr - 4 Pa 4 | Video Oficial",ElAlfaElJefeTV,10,Music,"Music, Musica, Latino, Latin, Urban, Urbano, Trap, Reggaeton, Dembow, Rap, Hip Hop, Latin Hits, 2019 Hits, Puerto Rico, Dominican Republic, Mexico, Miami, New York, Spain, España, mundial, Republica, dominicana, Republica Dominicana, Fuego, Fire, Bugatti, El Alfa, El Jefe, El Hombre, La leyenda, el androide, el animal, el, criminal, the best",228,hd,false,True,1825669,14722,1165
XRRnP91SSrQ,2025-12-05T16:00:21Z,Welcome Home | Poppy Playtime Chapter 5 Cinematic Trailer,Mob Entertainment,20,Gaming,,58,hd,true,True,1787749,161221,11923
Pe6vB0-8QZ4,2025-12-05T22:55:34Z,SOBREVIVÍMOS 3 dias en el APOCALIPSIS... 💀☢️😰 SILVIOGAMER en MIMESIS con AMIGOS,Silvio Gamer,20,Gaming,"SILVIO, SILVIOGAMER, SILVIO GAMER, MINECRAFT, Silvio, silviogamer, silvio, silvio gamer, minecraft silvio, silvio minecraft, silviogamer minecraft, minecraft silviogamer, silviogamer minecraft pero, minecraft pero, mimesis, sobrevivimos, sobrevivímos, 3 dias, dias, apocalipsis, sobrevivimos 3 dias al apocalipsis, sobrevivimos 3 dias, dia, pancracio, dany, permon, doppleganger, dopplegangers, impostores, impostor",2572,hd,false,True,458372,16792,1631
eiR_z_CVmpg,2025-12-05T00:00:06Z,Ysrael Barajas - NOAH & ALLIE (Video Oficial ),YsraelbarajasVEVO,10,Music,"latin, latin music, musica en español, mexico, video, video oficial, video con letra, lyric, lyrics video, video letra, letra de la canciónysrael barajas, israel, ysrael, barajas, noah, allie, noah allie, corridos, corridos tumbados, puros ya saben, puros corridos tumbados, noa allie, Desperate, Down, Electro Urbano, Emotional, Heartbreak, Hurt, Melancholy, Música Mexicana, Nostalgic, Reflective, Regional Mexican, Sad, Ysrael Barajas",244,hd,true,True,457580,54330,2265
t7q8pI_B-TQ,2025-12-05T21:43:57Z,ANÁLISIS COMPLETO del TRAILER del EPISODIO 7 - The Amazing Digital Circus,Sinergia Experimental,1,Film & Animation,"the amazing digital circus, el asombroso circo digital, circo digital, sirco, circo, digital, el increible circo digital, circo digital español, circo digital en español, circo digital roblox, circo digital intro, Amazing Digital Circus resumen, Pomni, Que es el asombroso circo digital, Que es the amazing digital circus, Asombroso Circo Digital Teorias, Circo Digital, Digital Circus, Piloto Digital Circus, The Amazing Digital Circus piloto, pomni x jax, ver el circo digital, caine",482,hd,false,True,80343,3577,277
esPT8WCk_AQ,2025-12-05T17:16:52Z,Me Volví LOCO por un Charizard de 2.900€,Rubius Z,24,Entertainment,"elrubius, rubius, nuevo, 2025, card, tcg, pokemon, charizard, inferno x, hit, full art, ex, new, opening, cartas, phantasmal flames, mega charizard x, mega, carta, cara, caro, meowth, 2026, dinero, cajas, caja, unboxing, sorpresa, mistery, box, meme, memes, gracioso, divertido",1343,hd,false,True,972697,79499,1590
dDwoyrVcbEo,2025-12-05T06:00:06Z,Alex Torres X Luis R Conriquez X Anuel AA - Por Si Se Les Olvidaba (REMIX) [Video Oficial],Alex Torres,10,Music,"alex torres, alex torres oficial, alex torres musica, alex torres videos, regional mexicano, sierreño, música mexicana, luis r conriquez, anuel aa, por si se les olvidaba, por si se les olvidaba remix, alex torres por si se les olvidaba remix, alex torres por si se les olvidaba remix video, alex torres por si se les olvidaba remix video oficial, alex torres por si se les olvidana remix oficial, luis r conriquez oficial, luis r conriquez musica, luis r conriquez canciones",179,hd,false,False,500617,37970,1914
N7e6vcKoFzM,2025-12-05T23:03:32Z,TRAILER EN ESPAÑOL | EPISODIO 7 The Amazing Digital Circus,YezzidTazz,24,Entertainment,"the amazing digital circus, el circo digital, pomni, jax, ragatha, el maravilloso circo digital, digital circus, digital circus episodio 7, digital circus trailer, digital circus capitulos completos, digital circus ponmi, parejas digital circus, digital circus adelanto capitulo 7, digital circus personajes, digital circus trailer en español, digital circus episodio 7 trailer en español, detalles ocultos digital circus, episodio 7 digital circus, digital circus 7 trailer",60,hd,false,True,21007,629,46
yDuaNgeMs6Y,2025-12-05T01:50:53Z,BAJÉ AL ASCENSOR EN ROBLOX!,FedeGames,20,Gaming,"minecraft, videos de juegos, juegos, gameplays, fede games, fede gameplays, videos de minecraft, vecibanda, fede y sus vecinos, fede vigevani, federico vigevani, vecinos minecraft, videojuegos, bajé al ascensor, roblox",1033,hd,false,True,2971099,97691,6963
DRoZT_x8Aw4,2025-12-06T06:15:23Z,LUZ DE LUNA,HUMBE - Topic,10,Music,"HUMBE, DUEÑO DEL CIELO, LUZ DE LUNA",339,hd,false,True,19055,3617,395
OUjALZAVAz0,2025-12-06T00:43:26Z,THE AMAZING DIGITAL CIRCUS  EPISODIO 7 | TRAILER,FanGirl,1,Film & Animation,"Miraculous, Ladybug",500,hd,false,True,37042,1601,176
-2FtOwHotso,2025-12-05T17:30:01Z,CLASE GAMBLER🎰 99 NOCHES CON LOS BROS! #9,ElAbrahaham,20,Gaming,"abrahahamflores, stream, entretenimiento, divertido, risa, gracioso, gamer, videojuegos, elabrahaham, copilacion, videos graciosos, antes vs ahora, mexico vs usa, abrahaham, directos, shorts, tiktoks, streams, twitch, reaccion, reacciones",3731,hd,false,True,560059,15377,1989
j-cEIYJNfqA,2025-12-05T12:33:06Z,"Grupo Firme, Banda MS, Grupo Frontera, Carin Leon, La Adictiva ♫ Bandas Mix 2025 Lo Mas Sonadas",Banda Mix Éxitos,10,Music,"banda mix, banda ms, bandas romanticas, la adictiva, la arrolladora, calibre 50, banda Mexicana, banda musica, mix de bandas, banda el recodo, banda, julión Álvarez, bandas mix, lo mejor banda romanticas, carin leon, mix bandas, musica banda, banda machos, bandas, gerardo Ortiz, alfredo olivas, musica de banda, grupo firme, mix banda, banda romantica, christian nodal, banda el limon, lo mas nuevo, grupo frontera, Bandas Mix 2025 Lo Mas Sonadas, Bandas Mix 2025",6434,hd,false,True,52183,440,3
LW4HgHdKmnM,2025-12-05T16:02:00Z,El tráiler de Poppy 5 CONFIRMA la teoría que todos ignoraron,Sr LOBO,20,Gaming,"sr lobo, srlobo, Poppy Playtime, Poppy Playtime 5, Poppy Playtime capítulo 5, tráiler Poppy Playtime 5, análisis tráiler Poppy Playtime 5, análisis Poppy Playtime 5, explicación tráiler Poppy 5, Poppy Playtime teoría, Experimento 1006, análisis 1006, Lily Loverbraids, nuevo personaje Poppy Playtime, monstruo cresta Poppy Playtime, Outimals, Poppy Playtime 5 secretos, secretos trailer Poppy Playtime 5, easter eggs Poppy Playtime 5, chapter 5 trailer analysis",543,hd,false,True,58057,1977,189
PgTkTZvv0mE,2025-12-05T19:33:09Z,Este Freddy Azul Es Mas Rapido Y Bugeado En Hello Neighbor / FNAF Bear 5 Mod,Omenasito,20,Gaming,"fnaf, fnaf in real time, fnaf real time, fnaf in real time gameplay, fnaf en tiempo real, fnaf trailer, fnaf movie, five nights at freddys, five nights at freddys trailer, fnaf plus, fnaf update, fnaf noticias, fnaf 1 fangame, fnaf fangame, mejores fangames, en tiempo real, realista, juego completo, 20/20/20/20, custom night, fnaf pelicula, hello neighbor, fredbear, those nights at freadbear, hello neighbor fredbear, fredbear rapido, mods de fnaf, fredbear mod, FNAF, bear5",1413,hd,false,True,532480,16917,1101
gU5ev2RhjeE,2025-12-05T18:00:06Z,Grupo Frontera  -  se me sale  (Video Oficial),Grupo Frontera,24,Entertainment,,163,hd,false,True,65709,6582,340
IaEtA56pd_w,2025-12-05T20:48:18Z,Iron Lung: Final Trailer,Markiplier,20,Gaming,"markiplier, iron lung, iron lung movie, official trailer, movie trailer, iron lung trailer 3, final trailer, iron lung release date, iron lung markiplier, Caroline Kaplan, troy baker",105,hd,false,False,2084361,325031,16821
aSpCcVgaULI,2025-12-05T21:01:36Z,Encontramos un COCHE ROBADO Debajo de una Casa en Minecraft,Nacho,20,Gaming,"nacho, dagar, nacho minecraft, dagar y nacho, nacho y dagar, minecraft, minecraft mod, dagar minecraft, coches, coches minecraft, auto, carros minecraft, garaje, garaje minecraft, garaje de coches minecraft, garaje noob, noob vs pro, abandonado, coche abandonado, carro abandonado, super coche, super auto, lambo, lambo minecraft, lamborghini minecraft, coche robado, coche robado minecraft, auto robado robado minecraft, carro robado",1275,hd,false,True,423213,6099,474
R5yF05mC870,2025-12-05T23:00:41Z,Gerardo Diaz y Su Gerarquia - Pasito a Pasito (Video Oficial),AfinArte Music,10,Music,"afinarte, music",166,hd,false,True,39626,1733,72
cm0fMAWvMtI,2025-12-06T03:11:14Z,¡JAX SE ABSTRAERA! ANALISIS del TRAILER del EPISODIO 7 de DIGITAL CIRCUS,Zona Tiza,1,Film & Animation,,505,hd,false,True,15632,1290,140
m2QvSL2olm0,2025-12-06T00:22:22Z,EL MCTRIO VOLVIÓ A REPO… ¡Y TODO SE DESCONTROLÓ! 🔥,ElMariana Gaming,20,Gaming,"el mariana, streams completos el mariana, el mariana momentos divertidos, el mariana y rivers, vlog elmariana, resubidos el mariana, elmariana, mariana, McTrio, Repo, Repo gameplay, ElMariana, Roier, AldoGeo, gameplay español, juego de terror, terror divertido, funny moments, juegos raros, videojuegos 2025, gameplay latino, humor gamer, sustos, fails, juegos cooperativos, juegos multijugador, emoji terror, juego nuevo, lets play español, contenido gaming, repo game español",1032,hd,false,True,205881,12553,286
qPD5JXGiLPU,2025-12-04T17:00:06Z,Fuerza Regida - Pero No Te Enamores (Letra),Latin Love,10,Music,"latin, latinLove, Latin Love, Letra, Lyrics, Fuerza Regida, Pero No Te Enamores, Pero No Te Enamores (Letra), Fuerza Regida - Pero No Te Enamores (Letra)",181,hd,false,True,144311,270,0
avtunpP2a9M,2025-12-04T00:00:01Z,El Gran Diluvio | Tráiler oficial | Netflix,Netflix Latinoamérica,24,Entertainment,"Corea del Sur, El Gran Diluvio, Kim Da-mi, Netflix, Park Hae-soo, SF, The Great Flood, acción, blockbuster, catástrofe, ciencia ficción, desastre, diciembre, director Kim Byung-woo, estreno, nuevo lanzamiento, películas coreanas, sci-fi, taquillazo, una película de Netflix",124,hd,false,False,449070,4638,160
m9kxfDPadJY,2025-12-05T19:53:11Z,JUGAMOS una TORRE TROLL de NAVIDAD en Roblox con Mandarina,Lyna,20,Gaming,,875,hd,false,True,440509,5800,519
85ETxUOFnfM,2025-12-04T18:00:06Z,Danny Ocean - Me Rehúso (Letra),Caribeo,22,People & Blogs,,206,hd,false,True,379996,535,5
4apcm-wbPyM,2025-12-05T21:15:00Z,ESTE NUEVO FREDBEAR ES MAS RAPIDO QUE EL ORIGINAL EN HELLO NEIGHBOR (FNAF MOD COMPLETO),Chuy Mine,20,Gaming,"chuymine, chuy mine, ESTE NUEVO FREDBEAR ES MAS RAPIDO QUE EL ORIGINAL EN HELLO NEIGHBOR, ESTE NUEVO FREDBEAR ES MAS RAPIDO QUE EL ORIGINAL, ESTE NUEVO FREDBEAR ES MAS RAPIDO, NUEVO FREDBEAR ES MAS RAPIDO QUE EL ORIGINAL, FREDBEAR ES MAS RAPIDO, HELLO NEIGHBOR, FNAF MOD, FNAF, FNAF MOD COMPLETO, NUEVO FREDBEAR, NUEVO FREDBEAR ES MAS RAPIDO, FREDBEAR ES MAS RAPIDO QUE EL ORIGINAL",1360,hd,false,True,352297,3325,283
gyyowAoPrsQ,2025-12-05T00:00:08Z,José Madero - Te Veo a la Vuelta,JoseMaderoVEVO,10,Music,"José Madero, Cascabel, Latin Rock",248,hd,false,True,119782,15566,1482
UskCmjT1PfQ,2025-12-05T22:18:47Z,Me Convertí en el 67 KID para AYUDAR a Mi AMIGA en Minecraft...,DanoMC,20,Gaming,"Me Convertí en el 67 KID para AYUDAR a Mi AMIGA en Minecraft, danomc, dano, mc, niki, me converti para ayudar a mi amiga, ayudar a mi amiga en minecraft, me converti en 67, me converti en 67 para ayudar a mi amiga, danomc 67, danomc 67 kid, 67, 67 kid, 67 brainrot, 67 meme, minecraft, keciyo, superkeciyo, danomc y niki, danomc ayude a mi amigo, danomc ayuda a niki, danomc amiga, danomc chica, dano y niki, danomc trolea a arsel, danomc minecraft, minecraft mod, minecraft pero",1567,hd,false,True,257234,3083,226
FfxLWmS1Nbs,2025-12-05T23:05:06Z,"Grupo Clasificado, Grupo Recluta - El Trato (Video Oficial)",GrupoClasificadoVEVO,10,Music,"Grupo Clasificado, Grupo Recluta, Regional Mexicano",214,hd,false,True,34952,1522,40
iqYbvE89TUo,2025-12-06T00:24:17Z,Encontrando TODOS LOS BRAINROTS en Find The Brainrot... | Karim Juega,Karim Juega,20,Gaming,"karim juega, karimjuega, encuentra un brainrot, find the brainrot, 240 brainrot, secreto, brainrtos secretos, brainrot og, desbloquea todos los brainrots, lugar oculto, oscuro secreto brainrot, hacker brainrots, todos los brainrots, find brainrot, lyna, mandarina, roba un brainrot, brainrots escondidos, juegos karim juega, videos karim juega",1510,hd,false,True,131430,1237,
fJEE7IXCOgA,2025-12-04T23:44:04Z,SALI A BUSCARLE,Raúl Beltran - Topic,10,Music,"Raúl Beltran, Jaziel Avilez, Desde El Rancho 3 Potrillos, SALI A BUSCARLE",215,hd,false,True,53762,678,4
q5o1z2dlq8E,2025-12-05T19:15:06Z,LOS VIDEOS MAS RAROS de 99 NOCHES EN EL BOSQUE 🤨😳 (Parte 3),ChuuyMine,20,Gaming,"LOS VIDEOS MAS RAROS de 99 NOCHES EN EL BOSQUE 🤨😳 (Parte 3), LOS VIDEOS MAS RAROS de 99 NOCHES EN EL BOSQUE, VIDEOS MAS RAROS de 99 NOCHES EN EL BOSQUE, 99 NOCHES EN EL BOSQUE, LOS VIDEOS MAS RAROS de 99 NOCHES, 99 NOCHES, chuuymine, 99 noches chuuymine, chuuymine 99 noches, 99 noches en el bosque chuuymine, chuuymine 99 noches en el bosque, videos raros chuuymine, chuuymine videos raros",1859,hd,false,True,235325,2415,248
MXt03sI73PM,2025-12-05T03:11:00Z,La Gran Señora (Banda),Jenni Rivera - Topic,10,Music,"Jenni Rivera, La Gran Señora",237,hd,false,True,249500,3156,189
n09iOx6NwP0,2025-12-06T01:05:28Z,DEBATE DEL MUNDIAL CON LA COBRA Y LATINOS ! DjMaRiiO,DjMaRiiO,20,Gaming,"djmariio, djmario, djmarrio, djmarioo, dj, mario, mariio, fut, fifa, futdraft, draft, plantilla, discard, challenge, pack, opening, handicap, pc, español, trucos, spain, spanish, el camino, MODO HISTORIA, PS5, PS4, ea sports fc, kings league, kings league oficial, ultimate mostoles, fc 25 modo carrera, fifa 25 modo carrera, fc 25 ultimate team, fc 25 gratis, fc 25 nintento switch, fut 25, fifa 25, 25, ea sports fc 25, fifa 25 ps4, fc 25 ps4, fc 25 djmariio, fc 26, ea sports fc 26, la cobra, debates",20286,hd,false,True,347463,4846,35
gc_CHFFrf80,2025-12-04T10:01:15Z,NAQUETO,Yng Lvcas - Topic,10,Music,"Yng Lvcas, NAQUETO",236,hd,false,True,72885,3249,48
APJ-lT0sBhg,2025-12-05T14:56:45Z,GTA Online: A Safehouse in the Hills Coming December 10,Rockstar Games,20,Gaming,"GTA Online, GTAV, GTA5 Online, GTA 5, GTA Online Update, A Safehouse in the Hills, PS5, PS4, PlayStation 5, PlayStation 4, Xbox Series X|S, Xbox One, PC, Mansions, Michael De Santa",61,hd,true,True,1219873,104146,9073
SixTbTc6YCg,2025-12-05T17:00:06Z,"Ice Spice, Tokischa - Thootie",IceSpiceVEVO,10,Music,"Ice Spice, Tokischa, 10K Projects/Capitol Records, Hip Hop",153,hd,true,True,516179,48821,2663
AIhiOVZmX8Y,2025-12-05T23:33:37Z,"CÓMO EDITÉ:  ""Red Dead Online fue desperdiciado"" - El Último Círculo",El Penúltimo Triángulo,20,Gaming,"El Ultimo Circulo, El Penultimo Triangulo, Red Dead Online, Red Dead Redemption 2, RDO, Red Dead Redemption 2 El Ultimo Circulo, El Ultimo Circulo Red Dead Redemption 2, Felipunks, Detras de Escenas, Detras de Camaras, Como Edité, Tutorial Edicion, Animacion",1208,hd,false,True,124688,17108,1205
2yGZPCjtGJ8,2025-12-05T00:00:08Z,Paulo Londra - 1% (feat. Eladio Carrión) [Official Video],Paulo Londra,10,Music,"Paulo Londra, Eladio Carrión, Eladio Carrion, Boxeo, Laveladadelaño, Paulo Londra nuevo video, Eladio Carrión nuevo tema, Paulo Londra videoclip oficial, latin trap, trap latino, urban latin, hip hop latino, rap latino, reggaeton trap, música urbana, Bad Bunny, Anuel AA, Myke Towers, Feid, Duki, Nicki Nicole, Trueno, Bizarrap, YSY A, Neo Pistea, Tiago PZK, Cazzu, Rauw Alejandro, J Balvin, Karol G, Mora, Quevedo, Nicky Jam, Ñengo Flow, Arcángel, Young Miko, milo j",244,hd,false,True,678332,87450,4680
LNAAU6ptIX4,2025-12-05T23:09:16Z,LE COMPARTO MI ROPA A MI FUTURA DUITA Y ASI LOGRAMOS UN BOOYAH INCREÍBLE en FREE FIRE !! 😱,SOYTINCA,20,Gaming,,768,hd,false,True,248660,11445,544
pW7zdjmorHc,2025-12-05T00:00:06Z,CD9 - ROCKSTAR (Lyric Video),CD9VEVO,10,Music,"CD9, EMI, Latin Pop",153,hd,false,True,67889,12905,1826
YN6uGlkKxLc,2025-12-06T01:48:39Z,Hotel POBRE vs MILLONARIO en Minecraft!,Awita,20,Gaming,,3278,hd,false,True,166299,4239,828
OfpaUiaSNoc,2025-12-05T00:00:06Z,"Carla Morrison, Pablo Alborán - Si Te Quedas (Official Video)",CarlaMorrisonVEVO,10,Music,"carla morrison, pablo alboran, carla morrison pablo alboran, si te quedas carla morrison, si te quedas letra carla morrison pablo alboran, carla morrison 2025, pop latino 2025, pablo alboran 2025, Carla Morrison Pablo Alborán, Latin Pop, Loving, Si Te Quedas",177,hd,false,True,237815,17843,736
sO8Zia5j0Mw,2025-12-05T21:45:04Z,Usando el NUEVO Glitch de la ALFOMBRA VOLADORA Para ROBAR en Steal a Brainrot!,TurboBlox,20,Gaming,"turbo, sara, amanda, maya, eva, turbo y amanda, turbo y sara, turbo y maya, Usando el NUEVO Glitch de la ALFOMBRA VOLADORA Para ROBAR en Steal a Brainrot!",845,hd,false,True,176125,2433,154
WyX8FPQvzmU,2025-12-02T10:30:21Z,Grupo Niche - Gotas de Lluvia (Letra/Lyrics),LatinVerse,22,People & Blogs,"latin verse, latinverse lyrics, latinverse, latin verse lyrics, grupo niche gotas de lluvia, gotas de lluvia, gotas de lluvia grupo niche, grupo niche gotas de lluvia letra, gotas de lluvia letra, gotas de lluvia grupo niche letra, grupo niche gotas de lluvia lyrics, gotas de lluvia lyrics, gotas de lluvia grupo niche lyrics, tiktok, tiktok song, tiktok remix, lyrics on screen",355,hd,false,True,60483,90,0
3JN7otg8vGI,2025-12-05T20:59:50Z,Así Podrás Conseguir Todos los Brainrots Secretos en FIND THE BRAINROT✅,Baironelblox,20,Gaming,"find the brainrot roblox, roblox find the brainrot, roblox games, no copyright gameplay, roblox find the games, find the brainrots, find the brainrot 215, find the roblox, baironelblox, roblox, roblox brainrot",1514,hd,false,True,222774,3887,107
Xzz9lIIEE8U,2025-12-05T12:01:15Z,1 HORA DE PUROS CORRIDOS DE LOS TIGRES DEL NORTE - LOS TIGRES DEL NORTE MIX ÉXITOS CANCIONES 2025,Recuerdos del Ayer,22,People & Blogs,"tigres del norte, los tigres del norte, 1 hora de puros corridos de los tigres del norte, los tigres del norte mix, los tigres del norte éxitos, puros, corridos, los tigres del norte corridos, los tigres del norte jefe de jefes, tigres del norte viejitas, tigres del norte corridos, los tigres del norte viejitas, los tigres del norte la puerta negra, corridos mexicanos, corridos para pistear, corridos exitos, tigres del norte ni parientes somos, tigres del norte la puerta negra",6080,hd,false,True,27822,441,2
